135,Male,49,,,45 - 49,Working - Full Time (30+ HRS),,White - Irish,,5: Very concerned,5: Very concerned,5: Very concerned,4,5: Very concerned,5: Very concerned,4,4,5: Very concerned,4,4,4,Very Satisfied,Very Satisfied,Fairly Satisfied,Very Satisfied,Fairly Satisfied,Fairly Satisfied,Social Care Services (Adults or Children),,,,,,,,NEITHER AGREE NOR DISAGREE,(DON’T KNOW/NO OPINION),TEND TO AGREE,TEND TO AGREE,TEND TO AGREE,NEITHER AGREE NOR DISAGREE,TEND TO AGREE,TEND TO AGREE,Internet via computer / laptop,,Internet via an iPad,,Internet via an Android smartphone,,,,,,,Gives us only a Limited Amount of Information,Gives us only a Limited Amount of Information,Gives us only a Limited Amount of Information,Gives us only a Limited Amount of Information,Doesn't Tell Us Much At All,Westminster Reporter (the council’s magazine) - (PICTURE A),,,,,,,,,,,,Fairly Useful,,,,,,,,,,By publication,By Post or Letter,,,,,,,,,,,,Not a very big problem,Not a very big problem,Not a very big problem,Not a very big problem,Not a problem at all,Not a problem at all,Not a problem at all,Not a very big problem,A fairly big problem,Not a very big problem,Not a problem at all,Not a very big problem,A fairly big problem,Not a very big problem,Not a problem at all,Not a very big problem,Not a problem at all,Not a very big problem,Not a problem at all,Very Safe,Fairly Safe,A Great Deal,Not At All,Not At All,Not Very Much,A Fair Amount,A Fair Amount,Not At All,"I have done this, but not primarily for the benefit of the environment",(Not applicable),"I have done this, primarily for the benefit of the environment","I have done this, but not primarily for the benefit of the environment","I have not done this, but I would be willing to start for the benefit of the environment","I have done this, but not primarily for the benefit of the environment",I have not done this – and I’m unlikely to do so,"I have done this, but not primarily for the benefit of the environment",No,,Definitely Agree,None at all,Owns With A Mortgage Or Loan,Fairly Unlikely,,,,,,,,,,,,,,,,,,,,,,,,I am relatively comfortable financially,,,,,,,Paying credit card bills,,,,,,3,,1,,Yes,No,7,8,8,8,Hardly ever or never,Hardly ever or never,Hardly ever or never,NHS GP in the Westminster City Council Area,UK,,,,,Always Lived Here,Little Venice,Metropolitan money,Gym & juices,2,E00023755,E01004703,1.016170699
136,Male,49,,,45 - 49,Working - Full Time (30+ HRS),,White - British,,5: Very concerned,5: Very concerned,5: Very concerned,5: Very concerned,5: Very concerned,5: Very concerned,5: Very concerned,5: Very concerned,5: Very concerned,5: Very concerned,5: Very concerned,5: Very concerned,Fairly Satisfied,Fairly Satisfied,Fairly Satisfied,Fairly Satisfied,Fairly Satisfied,Fairly Satisfied,,,,,,,None of these,,TEND TO AGREE,TEND TO DISAGREE,TEND TO AGREE,TEND TO AGREE,TEND TO AGREE,TEND TO AGREE,TEND TO AGREE,TEND TO AGREE,Internet via computer / laptop,Internet via an iPhone,Internet via an iPad,,,,,,,,,Keeps Us Fairly Well Informed,Keeps Us Fairly Well Informed,Keeps Us Fairly Well Informed,Keeps Us Fairly Well Informed,Keeps Us Fairly Well Informed,,,,Council website (www.westminster.gov.uk) - (PICTURE D),,,"Westminster City Save website, brochure or card (the council’s discount scheme www. westminster.gov.uk/citysave - (PICTURE G)",,,,,,,,,Very Useful,,,Fairly Useful,,,,By publication,,,,Website,,,,,,,,,Not a very big problem,Not a very big problem,Not a very big problem,Not a problem at all,Not a very big problem,Not a problem at all,Not a very big problem,Not a very big problem,A fairly big problem,Not a very big problem,Not a very big problem,Not a very big problem,Not a very big problem,Not a very big problem,Not a very big problem,Not a very big problem,Not a very big problem,Not a very big problem,Not a very big problem,Fairly Safe,Fairly Safe,Not At All,Not At All,Not At All,A Great Deal,A Great Deal,Not At All,Not Very Much,"I have done this, but not primarily for the benefit of the environment","I have done this, but not primarily for the benefit of the environment","I have not done this, but I would be willing to start for the benefit of the environment","I have not done this, but I would be willing to start for the benefit of the environment","I have not done this, but I would be willing to start for the benefit of the environment","I have not done this, but I would be willing to start for the benefit of the environment","I have done this, but not primarily for the benefit of the environment","I have done this, primarily for the benefit of the environment",No,,Tend to Agree,None at all,Rents (With Or Without Housing Benefit),Very Unlikely,,,,,,,,,,,,,,,,,,,,,,,,I am just about managing financially,,,,,,,,Paying loans,,,,,3,,0,,No,No,10 - completely,9,10 - completely,9,Hardly ever or never,Hardly ever or never,Hardly ever or never,NHS GP Elsewhere in London,UK,,,,,Always Lived Here,St. James's,Younger professionals in smaller flats,Five-a-day greys,15,E00023937,E01004736,1.016170699
137,Female,24,,,16 - 24,Working - Full Time (30+ HRS),,White - British,,5: Very concerned,4,5: Very concerned,4,5: Very concerned,5: Very concerned,4,5: Very concerned,5: Very concerned,4,Not applicable ,5: Very concerned,Very Satisfied,Very Satisfied,Fairly Satisfied,Fairly Satisfied,Fairly Satisfied,Fairly Satisfied,,,,,,,None of these,,STRONGLY AGREE,TEND TO AGREE,TEND TO AGREE,TEND TO AGREE,STRONGLY AGREE,TEND TO AGREE,TEND TO AGREE,STRONGLY AGREE,Internet via computer / laptop,Internet via an iPhone,,,,,,,,,,Gives us only a Limited Amount of Information,Gives us only a Limited Amount of Information,Gives us only a Limited Amount of Information,Gives us only a Limited Amount of Information,Gives us only a Limited Amount of Information,,,,Council website (www.westminster.gov.uk) - (PICTURE D),,,,,,,,,,,,Fairly Useful,,,,,,,By publication,,,,,,,,,,,,,Not a very big problem,Not a very big problem,Not a very big problem,Not a very big problem,Not a very big problem,Not a very big problem,Not a problem at all,Not a very big problem,Not a very big problem,Not a problem at all,Not a very big problem,Not a very big problem,A fairly big problem,Not a very big problem,Not a very big problem,Not a very big problem,Not a problem at all,Not a very big problem,Not a problem at all,Very Safe,Fairly Safe,A Fair Amount,Not Very Much,(Don't know),A Great Deal,A Great Deal,Not At All,Not Very Much,"I have not done this, but I would be willing to start for the benefit of the environment","I have done this, but not primarily for the benefit of the environment","I have done this, but not primarily for the benefit of the environment","I have not done this, but I would be willing to start for the benefit of the environment","I have done this, but not primarily for the benefit of the environment","I have not done this, but I would be willing to start for the benefit of the environment","I have done this, but not primarily for the benefit of the environment","I have done this, but not primarily for the benefit of the environment",No,,Tend to Agree,A fair amount,Rents (With Or Without Housing Benefit),Very Unlikely,,,,,,,,,,,,,,,,,,,,,,,,I am relatively comfortable financially,,,,,,,,,I am not concerned about any of these issues,,,,2,,0,,No,No,10 - completely,9,10 - completely,10 - completely,Hardly ever or never,Hardly ever or never,Hardly ever or never,NHS GP in the Westminster City Council Area,UK,,,,,11 to 15 Years,St. James's,Metropolitan professionals,Cultural concerns,16,E00023937,E01004736,0.894843959
138,Male,65,,,65 - 74,Working - Part Time (8 - 16 HRS),,White - British,,5: Very concerned,5: Very concerned,5: Very concerned,5: Very concerned,5: Very concerned,5: Very concerned,5: Very concerned,5: Very concerned,5: Very concerned,5: Very concerned,5: Very concerned,5: Very concerned,Fairly Satisfied,Fairly Satisfied,Fairly Satisfied,Fairly Satisfied,Neither Satisfied Nor Dissatisfied,Fairly Satisfied,,,,,,,None of these,,TEND TO AGREE,NEITHER AGREE NOR DISAGREE,TEND TO AGREE,TEND TO AGREE,TEND TO AGREE,TEND TO AGREE,TEND TO AGREE,TEND TO AGREE,Internet via computer / laptop,,,,Internet via an Android smartphone,,,,,,,Keeps Us Fairly Well Informed,Keeps Us Fairly Well Informed,Keeps Us Fairly Well Informed,Keeps Us Fairly Well Informed,Keeps Us Fairly Well Informed,,Westminster Plus (magazine for older people) - (PICTURE B),,Council website (www.westminster.gov.uk) - (PICTURE D),,,,,,,,,,Not very useful,,Very Useful,,,,,,,,,,,Website,,,,,,,,,Not a very big problem,Not a problem at all,Not a problem at all,Not a very big problem,Not a very big problem,Not a very big problem,Not a problem at all,Not a very big problem,Not a very big problem,Not a very big problem,Not a very big problem,Not a very big problem,Not a problem at all,Not a very big problem,Not a problem at all,Not a very big problem,Not a very big problem,Not a very big problem,Not a very big problem,Very Safe,Very Safe,A Fair Amount,A Fair Amount,(Don't know),A Fair Amount,A Great Deal,Not Very Much,A Fair Amount,"I have done this, but not primarily for the benefit of the environment","I have done this, but not primarily for the benefit of the environment","I have done this, but not primarily for the benefit of the environment","I have done this, but not primarily for the benefit of the environment","I have done this, but not primarily for the benefit of the environment","I have done this, but not primarily for the benefit of the environment","I have done this, but not primarily for the benefit of the environment","I have done this, but not primarily for the benefit of the environment",No,,Tend to Agree,Not very much,Rents (With Or Without Housing Benefit),Very Unlikely,,,,,,,,,,,,,,,,,,,,,,,,I am just about managing financially,,,,,,,,,I am not concerned about any of these issues,,,,2,,0,,No,No,10 - completely,10 - completely,10 - completely,9,Some of the time,Some of the time,Some of the time,NHS GP in the Westminster City Council Area,UK,"Other EU, EEA or Swiss national",,,,Always Lived Here,St. James's,Metropolitan money,Gym & juices,2,E00023937,E01004736,0.943327943
139,Female,71,,,65 - 74,Retired,,White - British,,4,5: Very concerned,Not applicable ,4,5: Very concerned,Not applicable ,5: Very concerned,4,5: Very concerned,4,Not applicable ,5: Very concerned,Neither Satisfied Nor Dissatisfied,Fairly Satisfied,Neither Satisfied Nor Dissatisfied,Fairly Satisfied,Neither Satisfied Nor Dissatisfied,Neither Satisfied Nor Dissatisfied,,,,,,,,Prefer not to say,NEITHER AGREE NOR DISAGREE,TEND TO DISAGREE,NEITHER AGREE NOR DISAGREE,NEITHER AGREE NOR DISAGREE,NEITHER AGREE NOR DISAGREE,NEITHER AGREE NOR DISAGREE,NEITHER AGREE NOR DISAGREE,TEND TO AGREE,Internet via computer / laptop,Internet via an iPhone,Internet via an iPad,,,,,,,,,Gives us only a Limited Amount of Information,Gives us only a Limited Amount of Information,Gives us only a Limited Amount of Information,Gives us only a Limited Amount of Information,Gives us only a Limited Amount of Information,Westminster Reporter (the council’s magazine) - (PICTURE A),Westminster Plus (magazine for older people) - (PICTURE B),,,,,,,,,,,Very Useful,Very Useful,,,,,,,,,,,,,,,,,,,None of these - I'm not interested,,,Not a problem at all,A fairly big problem,Not a very big problem,Not a problem at all,A fairly big problem,Not a problem at all,(Don't know),Not a problem at all,Not a very big problem,Not a problem at all,Not a very big problem,Not a very big problem,Not a very big problem,Not a very big problem,Not a very big problem,Not a very big problem,Not a problem at all,Not a very big problem,Not a problem at all,Fairly Safe,A Bit Unsafe,Not At All,Not At All,Not At All,Not Very Much,A Fair Amount,Not At All,Not Very Much,"I have done this, but not primarily for the benefit of the environment","I have done this, but not primarily for the benefit of the environment",(Not applicable),(Not applicable),"I have not done this, but I would be willing to start for the benefit of the environment","I have done this, primarily for the benefit of the environment","I have done this, primarily for the benefit of the environment","I have done this, primarily for the benefit of the environment",No,,Tend to Agree,A fair amount,Rents (With Or Without Housing Benefit),Very Unlikely,,,,,,,,,,,,,,,,,,,,,,,,I am just about managing financially,,,,,,,,,I am not concerned about any of these issues,,,,2,,0,,No,No,10 - completely,8,10 - completely,9,Some of the time,Some of the time,Hardly ever or never,NHS GP in the Westminster City Council Area,UK,,,,,Always Lived Here,St. James's,Metropolitan professionals,Cultural concerns,16,E00023937,E01004736,1.077531553
140,Female,57,,,55 - 59,Working - Full Time (30+ HRS),,White - British,,5: Very concerned,5: Very concerned,5: Very concerned,5: Very concerned,5: Very concerned,5: Very concerned,5: Very concerned,5: Very concerned,5: Very concerned,5: Very concerned,5: Very concerned,5: Very concerned,Fairly Satisfied,Fairly Satisfied,Fairly Satisfied,Fairly Satisfied,Fairly Satisfied,Fairly Satisfied,,,,,,,None of these,,TEND TO AGREE,TEND TO AGREE,TEND TO AGREE,NEITHER AGREE NOR DISAGREE,TEND TO AGREE,TEND TO AGREE,TEND TO AGREE,TEND TO AGREE,Internet via computer / laptop,Internet via an iPhone,,Internet via other tablet,,,,,,,,Keeps Us Fairly Well Informed,Gives us only a Limited Amount of Information,Keeps Us Fairly Well Informed,Keeps Us Fairly Well Informed,Gives us only a Limited Amount of Information,Westminster Reporter (the council’s magazine) - (PICTURE A),,Your council tax – providing an A-Z of the local services most important to you (delivered with your council tax bill in March 2020) - (PICTURE C),Council website (www.westminster.gov.uk) - (PICTURE D),,,,,,,,,Fairly Useful,,Fairly Useful,Very Useful,,,,,,,By publication,,,,Website,,,,,,,,,Not a very big problem,Not a very big problem,Not a very big problem,Not a very big problem,Not a very big problem,Not a very big problem,Not a problem at all,Not a very big problem,Not a very big problem,Not a very big problem,Not a very big problem,Not a very big problem,Not a very big problem,Not a very big problem,Not a very big problem,Not a very big problem,Not a very big problem,Not a very big problem,Not a very big problem,Fairly Safe,Fairly Safe,Not Very Much,(Don't know),Not At All,A Great Deal,A Great Deal,(Don't know),Not Very Much,"I have done this, but not primarily for the benefit of the environment","I have done this, but not primarily for the benefit of the environment","I have done this, but not primarily for the benefit of the environment","I have not done this, but I would be willing to start for the benefit of the environment","I have done this, but not primarily for the benefit of the environment","I have done this, but not primarily for the benefit of the environment","I have done this, but not primarily for the benefit of the environment","I have done this, but not primarily for the benefit of the environment",Yes (Specify below),Give to charity,Tend to Agree,None at all,Owns Outright,Very Unlikely,,,,,,,,,,,,,,,,,,,,,,,,I am just about managing financially,,,,,,,,,I am not concerned about any of these issues,,,,2,,0,,No,No,9,10 - completely,8,9,Hardly ever or never,Hardly ever or never,Hardly ever or never,NHS GP Elsewhere in London,UK,,,,,6 to 10 Years,St. James's,Younger professionals in smaller flats,Five-a-day greys,15,E00023937,E01004736,0.77238882
141,Male,41,,,35 - 44,Working - Full Time (30+ HRS),,Black or Black British - African,,5: Very concerned,5: Very concerned,5: Very concerned,4,5: Very concerned,Not applicable ,5: Very concerned,5: Very concerned,5: Very concerned,4,Not applicable ,4,Fairly Satisfied,Fairly Satisfied,Very Satisfied,Very Satisfied,Fairly Satisfied,Very Satisfied,,,,,,,None of these,,TEND TO AGREE,NEITHER AGREE NOR DISAGREE,TEND TO AGREE,TEND TO AGREE,TEND TO AGREE,TEND TO AGREE,TEND TO AGREE,TEND TO AGREE,Internet via computer / laptop,Internet via an iPhone,Internet via an iPad,,,,,,,,,Keeps Us Fairly Well Informed,Gives us only a Limited Amount of Information,Gives us only a Limited Amount of Information,Gives us only a Limited Amount of Information,Gives us only a Limited Amount of Information,Westminster Reporter (the council’s magazine) - (PICTURE A),,,Council website (www.westminster.gov.uk) - (PICTURE D),,,,,,,,,Not very useful,,,Very Useful,,,,,,,,,,,Website,,,,,,,,,Not a very big problem,Not a very big problem,Not a very big problem,Not a very big problem,Not a very big problem,Not a very big problem,Not a very big problem,Not a very big problem,A fairly big problem,Not a problem at all,Not a very big problem,Not a very big problem,Not a very big problem,Not a problem at all,Not a very big problem,Not a problem at all,Not a very big problem,Not a very big problem,Not a very big problem,Fairly Safe,A Bit Unsafe,Not Very Much,Not Very Much,Not At All,A Fair Amount,A Fair Amount,Not Very Much,Not Very Much,"I have done this, but not primarily for the benefit of the environment","I have done this, but not primarily for the benefit of the environment","I have not done this, but I would be willing to start for the benefit of the environment","I have not done this, but I would be willing to start for the benefit of the environment","I have not done this, but I would be willing to start for the benefit of the environment","I have not done this, but I would be willing to start for the benefit of the environment","I have done this, primarily for the benefit of the environment","I have done this, primarily for the benefit of the environment",No,,Definitely Agree,A fair amount,Rents (With Or Without Housing Benefit),Fairly Unlikely,,,,,,,,,,,,,,,,,,,,,,,,I am relatively comfortable financially,,,,,,,,,I am not concerned about any of these issues,,,,4,,1,,No,No,9,10 - completely,8,8,Hardly ever or never,Hardly ever or never,Hardly ever or never,NHS GP in the Westminster City Council Area,UK,,,,,More than 20 Years,St. James's,Business areas without resident population,Business areas without resident population,62,E00023937,E01004736,1.016170699
142,Female,51,,,50 - 54,Working - Full Time (30+ HRS),,White - British,,5: Very concerned,5: Very concerned,5: Very concerned,5: Very concerned,4,Not applicable ,5: Very concerned,5: Very concerned,5: Very concerned,5: Very concerned,Not applicable ,4,Neither Satisfied Nor Dissatisfied,Fairly Satisfied,Fairly Satisfied,Fairly Satisfied,Neither Satisfied Nor Dissatisfied,Neither Satisfied Nor Dissatisfied,,,,,,,None of these,,TEND TO AGREE,TEND TO DISAGREE,TEND TO AGREE,NEITHER AGREE NOR DISAGREE,NEITHER AGREE NOR DISAGREE,NEITHER AGREE NOR DISAGREE,NEITHER AGREE NOR DISAGREE,NEITHER AGREE NOR DISAGREE,Internet via computer / laptop,,,Internet via other tablet,Internet via an Android smartphone,,,,,,,Gives us only a Limited Amount of Information,Gives us only a Limited Amount of Information,Gives us only a Limited Amount of Information,Gives us only a Limited Amount of Information,Gives us only a Limited Amount of Information,Westminster Reporter (the council’s magazine) - (PICTURE A),Westminster Plus (magazine for older people) - (PICTURE B),,Council website (www.westminster.gov.uk) - (PICTURE D),,,,,,,,,Not very useful,Fairly Useful,,Fairly Useful,,,,,,,By publication,,,,Website,,,,,,,,,Not a problem at all,Not a very big problem,Not a very big problem,Not a very big problem,Not a very big problem,Not a very big problem,Not a very big problem,Not a very big problem,Not a very big problem,Not a problem at all,Not a problem at all,Not a problem at all,Not a very big problem,Not a very big problem,Not a very big problem,Not a problem at all,Not a problem at all,Not a very big problem,Not a very big problem,A Bit Unsafe,A Bit Unsafe,Not Very Much,A Fair Amount,Not At All,A Great Deal,A Fair Amount,Not At All,A Fair Amount,"I have done this, but not primarily for the benefit of the environment","I have done this, but not primarily for the benefit of the environment",(Not applicable),(Not applicable),"I have done this, primarily for the benefit of the environment","I have done this, but not primarily for the benefit of the environment","I have done this, but not primarily for the benefit of the environment","I have done this, but not primarily for the benefit of the environment",No,,Tend to Agree,A fair amount,Rents (With Or Without Housing Benefit),Very Unlikely,,,,,,,,,,,,,,,,,,,,,,,,I am just about managing financially,,,,,,,Paying credit card bills,,,,,,2,,0,,No,No,10 - completely,9,8,7,Hardly ever or never,Hardly ever or never,Hardly ever or never,NHS GP in the Westminster City Council Area,UK,,,,,16 to 20 Years,St. James's,Metropolitan money,Gym & juices,2,E00023937,E01004736,0.77238882
143,Male,40,,,35 - 44,Working - Full Time (30+ HRS),,Black or Black British - African,,5: Very concerned,5: Very concerned,5: Very concerned,5: Very concerned,5: Very concerned,Not applicable ,5: Very concerned,5: Very concerned,5: Very concerned,5: Very concerned,Not applicable ,5: Very concerned,Fairly Satisfied,Fairly Satisfied,Fairly Satisfied,Fairly Satisfied,Fairly Satisfied,Fairly Satisfied,,,,,,,None of these,,TEND TO AGREE,NEITHER AGREE NOR DISAGREE,TEND TO AGREE,NEITHER AGREE NOR DISAGREE,TEND TO AGREE,TEND TO AGREE,TEND TO AGREE,NEITHER AGREE NOR DISAGREE,Internet via computer / laptop,Internet via an iPhone,,,,,,,,,,Keeps Us Fairly Well Informed,Keeps Us Fairly Well Informed,Keeps Us Fairly Well Informed,Keeps Us Fairly Well Informed,Keeps Us Fairly Well Informed,Westminster Reporter (the council’s magazine) - (PICTURE A),,,Council website (www.westminster.gov.uk) - (PICTURE D),,,,,,,,,Not very useful,,,Fairly Useful,,,,,,,By publication,,,,Website,,,,,,,,,Not a very big problem,Not a very big problem,Not a very big problem,Not a very big problem,Not a very big problem,Not a very big problem,Not a very big problem,A fairly big problem,A fairly big problem,Not a very big problem,Not a very big problem,Not a very big problem,Not a very big problem,Not a very big problem,Not a very big problem,Not a very big problem,Not a very big problem,Not a very big problem,Not a very big problem,Very Safe,Fairly Safe,Not Very Much,Not Very Much,Not At All,A Great Deal,A Fair Amount,Not At All,A Fair Amount,"I have done this, but not primarily for the benefit of the environment","I have done this, but not primarily for the benefit of the environment","I have done this, primarily for the benefit of the environment",(Not applicable),"I have not done this, but I would be willing to start for the benefit of the environment","I have not done this, but I would be willing to start for the benefit of the environment","I have done this, primarily for the benefit of the environment","I have done this, primarily for the benefit of the environment",Yes (Specify below),Use less energy and re-use of bag.,Tend to Agree,A fair amount,Rents (With Or Without Housing Benefit),Fairly Unlikely,,,,,,,,,,,,,,,,,,,,,,,,I am relatively comfortable financially,,,,,,,,,I am not concerned about any of these issues,,,,3,,0,,No,No,6,8,7,5,Hardly ever or never,Hardly ever or never,Hardly ever or never,NHS GP in the Westminster City Council Area,UK,,,,,16 to 20 Years,St. James's,Metropolitan professionals,,16,E00023937,E01004736,1.016170699
144,Female,70,,,65 - 74,Retired,,White - British,,3,3,Not applicable ,3,1: Not at all concerned,Not applicable ,3,3,1: Not at all concerned,1: Not at all concerned,Not applicable ,2,Very Satisfied,Very Satisfied,Fairly Satisfied,Fairly Satisfied,Neither Satisfied Nor Dissatisfied,Neither Satisfied Nor Dissatisfied,,,,,,,None of these,,STRONGLY AGREE,(DON’T KNOW/NO OPINION),(DON’T KNOW/NO OPINION),STRONGLY AGREE,STRONGLY AGREE,STRONGLY AGREE,(DON’T KNOW/NO OPINION),STRONGLY AGREE,Internet via computer / laptop,Internet via an iPhone,,,,,,,,,,Keeps Us Fairly Well Informed,Keeps Us Fairly Well Informed,Keeps Us Fairly Well Informed,Keeps Us Fairly Well Informed,I don’t need this type of advice,Westminster Reporter (the council’s magazine) - (PICTURE A),,,,,,,,,,,,(Don't know / No opinion),,,,,,,,,,,By Post or Letter,,,,,,,,,,,,Not a problem at all,Not a problem at all,Not a problem at all,A fairly big problem,Not a very big problem,Not a problem at all,(Don't know),Not a problem at all,Not a problem at all,Not a problem at all,A fairly big problem,A very big problem,Not a problem at all,Not a problem at all,Not a problem at all,Not a problem at all,Not a very big problem,Not a very big problem,Not a problem at all,Very Safe,A Bit Unsafe,A Fair Amount,Not At All,Not At All,A Fair Amount,Not Very Much,Not At All,Not Very Much,"I have done this, primarily for the benefit of the environment",I have not done this – and I’m unlikely to do so,"I have not done this, but I would be willing to start for the benefit of the environment",I have not done this – and I’m unlikely to do so,"I have done this, but not primarily for the benefit of the environment","I have done this, but not primarily for the benefit of the environment",I have not done this – and I’m unlikely to do so,"I have done this, but not primarily for the benefit of the environment",No,,Definitely Agree,A fair amount,Owns Outright,Very Unlikely,,,,,,,,,,,,,,,,,,,,,,,,I am just about managing financially,,,,,,,,,I am not concerned about any of these issues,,,,,Don't know,,Don't know,No,No,8,7,6,4,(Prefer not to say),(Prefer not to say),(Prefer not to say),NHS GP in the Westminster City Council Area,UK,,,,,Always Lived Here,Abbey Road,Metropolitan money,Gym & juices,2,E00023413,E01004648,1.077531553
