case,S1,S2a,S2b:1,S2c,AGE,S3,S3o,Q58,Q58o,Q10a1,Q10a2,Q10a3,Q10a4,Q10a5,Q10a6,Q10a7,Q10a8,Q10a9,Q10a10,Q10a11,Q10a12,Q1,Q4a,Q4b,Q4c,Q4d,Q4e,Q5new:1,Q5new:2,Q5new:3,Q5new:4,Q5new:5,Q5new:6,Q5new:7,Q5new:8,Q9a,Q9b,Q9c,Q9d,Q9e,Q9f,Q9g,Q9j,Q9new:1,Q9new:2,Q9new:3,Q9new:4,Q9new:5,Q9new:6,Q9new:7,Q9new:8,Q9new:9,Q9new:10,Q9newo,Q12a,Q12b,Q12c,Q12d,Q12e,Q13:1,Q13:2,Q13:3,Q13:4,Q13:5,Q13:6,Q13:7,Q13:8,Q13:9,Q13:10,Q13:11,Q13:12,Q14a,Q14b,Q14c,Q14e,Q14f,Q14g,Q14h,Q14i,Q14j,Q14k,QNEW3:1,QNEW3:2,QNEW3:3,QNEW3:4,QNEW3:5,QNEW3:6,QNEW3:7,QNEW3:8,QNEW3:9,QNEW3:10,QNEW3:11,QNEW3:12,QNEW3o,Q17a,Q17b,Q17c,Q17d,Q17e,Q17g,Q17h,Q17i,Q17j,Q17k,Q17l,Q17n,Q17o,Q17p,Q17q,Q17r,Q17s,Q17t,Q17u,Q18a,Q18b,Q23a,Q23g,Q23b,Q23c,Q23d,Q23e,Q23f,Qnew10a,Qnew10b,Qnew10c,Qnew10d,Qnew10e,Qnew10f,Qnew10g,Qnew10h,Qnew10i,Qnew10o,Q27,Q31,Q34,Q42,Q43:1,Q43:2,Q43:3,Q43:4,Q43:5,Q43:6,Q43:7,Q43:8,Q43:9,Q43:10,Q43:11,Q43:12,Q43:13,Q43:14,Q43:15,Q43:16,Q43:17,Q43:18,Q43:19,Q43:20,Q43:21,Q43:22,Q43o,Q46,QNEW7:1,QNEW7:2,QNEW7:3,QNEW7:4,QNEW7:5,QNEW7:6,QNEW7:7,QNEW7:8,QNEW7:9,QNEW7:10,QNEW7:11,QNEW7o,Q50,Q50dk:1,Q51,Q51dk:1,Q53,Q55,Qnew12a,Qnew12b,Qnew12c,Qnew12d,Qnew13a,Qnew13b,qnew13c,Q57,QNew8:1,QNew8:2,QNew8:3,QNew8:4,QNew8o,Q60a,Ward,CategoryType,WellbeingType,AcornTypeCode,OutputArea,LowerSuperOutput,weight
case,GENDER,What is your age?,S2a refused code box,"Can I please ask which of the following age bands you fall into, we have to speak to a cross section of the public and this will ensure that our sample is representative?",AGE QUOTA,Can you tell me which of the following describes you. Are you....?,Other,To which of these ethnic groups do you consider you belong?,Other,My own economic wellbeing after the pandemic ,The economic wellbeing of my family and friends after the pandemic ,My job ,The jobs of my friends and family ,Losing my home ,Losing my business ,My physical health  ,The physical health of my friends and family ,My mental health ,The mental health of my friends and family ,Returning to school,Maintaining a healthy diet,How satisfied or dissatisfied are you with the way Westminster City Council is running the City?,Refuse collection,Street sweeping,Street lighting,Road maintenance,Pavement maintenance,Have you or anyone in your household used any of the following services in the past 12 months? Social Care Services (Adults or Children),Have you or anyone in your household used any of the following services in the past 12 months? Westminster Employment Services,Have you or anyone in your household used any of the following services in the past 12 months? Special Educational Needs,Have you or anyone in your household used any of the following services in the past 12 months? Homelessness Services,Have you or anyone in your household used any of the following services in the past 12 months? Debt advice,Have you or anyone in your household used any of the following services in the past 12 months? Westminster Connects Shielding Support,Have you or anyone in your household used any of the following services in the past 12 months? None of these,Have you or anyone in your household used any of the following services in the past 12 months? Prefer not to say,The Council gives local people good value for money,The council involves me in the decisions it makes about my local area,The Council is helpful when you contact it,The Council is open and transparent,The Council is efficient and well run,The Council does enough for people like me,The Council is making my local area a better place to live,The Council cares enough about its most vulnerable residents,How do you personally access the internet at home or at work? Internet via computer / laptop,How do you personally access the internet at home or at work? Internet via an iPhone,How do you personally access the internet at home or at work? Internet via an iPad,How do you personally access the internet at home or at work? Internet via other tablet,How do you personally access the internet at home or at work? Internet via an Android smartphone,How do you personally access the internet at home or at work? Internet via digital / satellite TV,How do you personally access the internet at home or at work? Internet via a games console connected to TV,How do you personally access the internet at home or at work? Other,How do you personally access the internet at home or at work? None of these,How do you personally access the internet at home or at work? Don't know,How do you personally access the internet at home or at work? Other specify,The services and benefits it provides,Their plans for your local area,How residents can help improve their local community or neighbourhood,Changes to council services,Career choices for yourself and your dependents?,"Which, if any, of the following have you seen or used in the last six months? Westminster Reporter","Which, if any, of the following have you seen or used in the last six months? Westminster Plus","Which, if any, of the following have you seen or used in the last six months? Your council tax","Which, if any, of the following have you seen or used in the last six months? Council website","Which, if any, of the following have you seen or used in the last six months? MyWestminster e-Newsletter","Which, if any, of the following have you seen or used in the last six months? Families First Newsletter","Which, if any, of the following have you seen or used in the last six months? Westminster City Save website, brochure or card","Which, if any, of the following have you seen or used in the last six months? 'Report It'","Which, if any, of the following have you seen or used in the last six months? YourHome Magazine","Which, if any, of the following have you seen or used in the last six months? YourHome E-Newsletter","Which, if any, of the following have you seen or used in the last six months? None of these","Which, if any, of the following have you seen or used in the last six months? Don't know",Westminster Reporter (the council’s magazine),Westminster Plus (magazine for older people),Your council tax – providing an A-Z of the local services most important to you (delivered with your council tax bill in March 2020,Council website www.westminster.gov.uk,MyWestminster e-Newsletter,Families First Newsletter,"Westminster City Save website, brochure or card (the council’s discount scheme www. westminster.gov.uk/citysave)",Report It’ (an online platform for reporting issues to the council),YourHome Magazine (the council’s magazine for Westminster housing residents),YourHome E-Newsletter,How do you prefer to receive news and information about the council’s services? By publication,How do you prefer to receive news and information about the council’s services? By post or letter,How do you prefer to receive news and information about the council’s services? Visit to home,How do you prefer to receive news and information about the council’s services? Email,How do you prefer to receive news and information about the council’s services? Website,How do you prefer to receive news and information about the council’s services? Twitter,How do you prefer to receive news and information about the council’s services? Facebook,How do you prefer to receive news and information about the council’s services? Instagram,How do you prefer to receive news and information about the council’s services? Text,How do you prefer to receive news and information about the council’s services? Other,How do you prefer to receive news and information about the council’s services? None of these - I'm not interested,How do you prefer to receive news and information about the council’s services? Don't know,How do you prefer to receive news and information about the council’s services? Other specify,Rubbish and litter lying around,People being drunk or rowdy,"People showing hostility or prejudice based on disability, race, religion, transgender identity or sexual orientation",Noisy neighbours or loud parties,anti-social behaviour,"Vandalism, graffiti and other deliberate damage",People using or dealing drugs,People homeless on the streets,People begging on the streets,Street entertainment and busking,Violence among young people,Dog fouling on pavements,Poor air quality,Smoking in public places,Noise from building sites,"Issues related to licensed premises (e.g. people drinking/smoking outside, blocked pavements, deliveries, etc.)","Issues related to commercial properties (e.g. noise, blocked pavements, deliveries)","issues related to deliveries to residential properties (such as orders from websites, shopping deliveries or deliveries from takeaways)",Short-term letting of your neighbour’s properties (e.g. people staying for short business or holiday breaks) PROMPT: Airbnb for example,"In general, in the area where you live",Walking alone in the area you live after dark,Car or van,Electric vehicle (runs solely on electricity or are plug-in hybrid),Motorbike,On foot/walking,Public transport,Cycling,Taxi,"Used less energy at home (i.e. by turning down the heating, insulating your home or using energy saving lighting and appliances)",Bought your electricity from a green energy supplier or generated any of your own energy ,Stopped idling your vehicle to reduce emissions or requested another driver do so (i.e. running a vehicle’s engine when the vehicle is not moving),Switched to driving a less polluting vehicle (i.e. with lower emissions),"Made fewer journeys by car, van or motorcycle and/or swapped these for more sustainable options (e.g. walking, cycling or public transport) ",Separated your food waste from other household waste ,Regularly used a reusable bottle or cup when away from home,Regularly used a reusable shopping bag,"And over the last 12 months, have you proactively taken any OTHER steps for the benefit of the environment?",What other steps you have taken for the benefit of the environment? Please type in,To what extent do you agree or disagree that this local area (within 15 to 20 mins walking distance) is a place where people from different backgrounds get on well together?,"How much time, if at all, do you personally spend doing something to help improve your community or neighbourhood?",Does your household rent or own this accommodation?,How likely or unlikely is it that you will move out of the Westminster City Council area in the next twelve months?,And why are you likely to move out of the Westminster City Council area in the next twelve months? Change of job,And why are you likely to move out of the Westminster City Council area in the next twelve months? Changes due to welfare system,And why are you likely to move out of the Westminster City Council area in the next twelve months? Cost of housing too high,And why are you likely to move out of the Westminster City Council area in the next twelve months? Cost of living too high,And why are you likely to move out of the Westminster City Council area in the next twelve months? Don't like the people her locally,And why are you likely to move out of the Westminster City Council area in the next twelve months? Don't want to live in a city anymore / want to move to countryside,And why are you likely to move out of the Westminster City Council area in the next twelve months? Don't want to live in London anymore,And why are you likely to move out of the Westminster City Council area in the next twelve months? Fear of crime in Westminster,And why are you likely to move out of the Westminster City Council area in the next twelve months? Going home / my damily lives elsewhere,And why are you likely to move out of the Westminster City Council area in the next twelve months? Need larger house for family,And why are you likely to move out of the Westminster City Council area in the next twelve months? Need to move for school places for children,And why are you likely to move out of the Westminster City Council area in the next twelve months? Concerns over Brexit,And why are you likely to move out of the Westminster City Council area in the next twelve months? No right to remain in the UK,And why are you likely to move out of the Westminster City Council area in the next twelve months? Only in Westminster on a temporary basis while studying here,And why are you likely to move out of the Westminster City Council area in the next twelve months? Only in Westminster on a temporary basis while visiting here,And why are you likely to move out of the Westminster City Council area in the next twelve months? Only in Westminster on a temporary basis while working here,And why are you likely to move out of the Westminster City Council area in the next twelve months? Want to raise children elsewhere,And why are you likely to move out of the Westminster City Council area in the next twelve months? Concerns over Covid-19,And why are you likely to move out of the Westminster City Council area in the next twelve months? Working from home means I can live elsewhere,And why are you likely to move out of the Westminster City Council area in the next twelve months? My financial situation has changed,And why are you likely to move out of the Westminster City Council area in the next twelve months? Other,And why are you likely to move out of the Westminster City Council area in the next twelve months? Don't know,Other specify,"Thinking about your finances, which of the following best reflects your position?","Thinking about your finances, which of the following are you concerned about at the moment? Paying fuel bills (e.g. gas, electricity)","Thinking about your finances, which of the following are you concerned about at the moment? Paying for rent / mortgage","Thinking about your finances, which of the following are you concerned about at the moment? Paying for food/grocery bills","Thinking about your finances, which of the following are you concerned about at the moment? Paying other bills or costs","Thinking about your finances, which of the following are you concerned about at the moment? Paying council tax","Thinking about your finances, which of the following are you concerned about at the moment? Paying childcare costs","Thinking about your finances, which of the following are you concerned about at the moment? Paying credit card bills","Thinking about your finances, which of the following are you concerned about at the moment? Paying loans","Thinking about your finances, which of the following are you concerned about at the moment? I am not concerned about any of these issues","Thinking about your finances, which of the following are you concerned about at the moment? Other","Thinking about your finances, which of the following are you concerned about at the moment? Don't know",Other specify,"Including yourself, how many people aged sixteen and over are staying in your home at the moment? This can include any visitors staying for more than a couple of days.",q50dk box,How many children under the age of sixteen are staying in your home at the moment?,q51dk box,"Do you look after, or give any help or support to family members, friends, neighbours or others because of long-term physical or mental ill-health or disability, or problems related to old age?","Are your day to day activities limited because of a health problem or disability which has lasted, or is expected to last, at least 12 months? Please include problems related to old age.","Overall, how satisfied are you with your life nowadays?","Overall, to what extent do you feel that the things you do in your life are worthwhile?","Overall, how happy did you feel yesterday?","On a scale where 0 is “not at all anxious” and 10 is “completely anxious”, overall, how anxious did you feel yesterday?",How often do you feel you lack companionship?,How often do you feel left out?,How often do you feel isolated from others?,And are you personally registered with an NHS GP in the Westminster City Council area or elsewhere?,What is your nationality? UK,"What is your nationality? Other EU, EEA or Swiss national",What is your nationality? Other specify,What is your nationality? Prefer not to answer,Other specify,How long have you lived in the UK? READ OUT - SINGLE CODE,Ward,CategoryType,WellbeingType,AcornTypeCode,OutputArea,LowerSuperOutputArea,weight
2,Female,65,,,65 - 74,"Unemployed, Not Registered-Seeking Work",,White - British,,5: Very concerned,5: Very concerned,3,5: Very concerned,5: Very concerned,5: Very concerned,4,4,5: Very concerned,4,2,2,Fairly Dissatisfied,Fairly Satisfied,Fairly Satisfied,Fairly Satisfied,Fairly Satisfied,Fairly Satisfied,,,,,,,None of these,,TEND TO AGREE,STRONGLY DISAGREE,TEND TO AGREE,STRONGLY DISAGREE,NEITHER AGREE NOR DISAGREE,STRONGLY DISAGREE,TEND TO AGREE,STRONGLY DISAGREE,Internet via computer / laptop,,,Internet via other tablet,Internet via an Android smartphone,,,,,,,Keeps Us Fairly Well Informed,Keeps Us Fairly Well Informed,Keeps Us Fairly Well Informed,Keeps Us Fairly Well Informed,Keeps Us Fairly Well Informed,Westminster Reporter (the council’s magazine) - (PICTURE A),Westminster Plus (magazine for older people) - (PICTURE B),,,,,,,,,,,Very Useful,Very Useful,,,,,,,,,,By Post or Letter,,,,,,,Text,,,,,Not a problem at all,Not a problem at all,Not a problem at all,Not a problem at all,Not a problem at all,Not a problem at all,A fairly big problem,A fairly big problem,A fairly big problem,Not a problem at all,Not a problem at all,Not a problem at all,A fairly big problem,Not a problem at all,A fairly big problem,Not a problem at all,A fairly big problem,Not a problem at all,Not a problem at all,Very Safe,Very Safe,Not At All,Not At All,Not At All,A Great Deal,A Great Deal,Not At All,Not At All,"I have done this, but not primarily for the benefit of the environment",(Not applicable),(Not applicable),(Not applicable),"I have done this, but not primarily for the benefit of the environment","I have done this, but not primarily for the benefit of the environment","I have done this, but not primarily for the benefit of the environment","I have done this, but not primarily for the benefit of the environment",No,,Definitely Agree,Not very much,Rents (With Or Without Housing Benefit),Fairly Likely,,,Cost Of Housing Too High,,,,,,,,,,,,,,,,,,,,,"I am not really managing financially, and often struggle to make ends meet",,,Paying for food/grocery bills,Paying other bills or costs,,,Paying credit card bills,,,,,,4,,2,,No,No,5,6,7,3,Hardly ever or never,Hardly ever or never,Hardly ever or never,NHS GP in the Westminster City Council Area,UK,,,,,Always Lived Here,Warwick,"Multi-ethnic, purpose-built estates",Sensible seniors,54,E00024058,E01004749,1.077531553
3,Female,26,,,25 - 34,Working - Full Time (30+ HRS),,Mixed - White and Asian,,2,2,3,3,3,3,2,2,2,2,2,2,Very Satisfied,Fairly Satisfied,Very Satisfied,Very Satisfied,Fairly Satisfied,Very Satisfied,,,,,,,None of these,,NEITHER AGREE NOR DISAGREE,TEND TO AGREE,TEND TO AGREE,TEND TO DISAGREE,TEND TO AGREE,NEITHER AGREE NOR DISAGREE,TEND TO AGREE,TEND TO AGREE,Internet via computer / laptop,,,Internet via other tablet,Internet via an Android smartphone,,,,,,,Keeps Us Very Well Informed,Keeps Us Very Well Informed,Keeps Us Very Well Informed,Keeps Us Fairly Well Informed,Keeps Us Very Well Informed,,,,,,,,,,,(None of these),,,,,,,,,,,,,By Post or Letter,,Email,Website,,,,,,,,,Not a problem at all,Not a problem at all,Not a problem at all,A fairly big problem,A fairly big problem,A fairly big problem,Not a problem at all,Not a problem at all,Not a problem at all,Not a problem at all,Not a problem at all,Not a problem at all,Not a very big problem,Not a problem at all,Not a problem at all,Not a very big problem,(Don't know),(Don't know),(Don't know),Very Safe,Fairly Safe,Not Very Much,Not At All,Not At All,A Great Deal,A Great Deal,Not At All,Not Very Much,"I have not done this, but I would be willing to start for the benefit of the environment","I have not done this, but I would be willing to start for the benefit of the environment",(Not applicable),(Not applicable),"I have not done this, but I would be willing to start for the benefit of the environment","I have done this, but not primarily for the benefit of the environment",(Not applicable),"I have done this, but not primarily for the benefit of the environment",No,,Tend to Agree,(Don't know),Rents (With Or Without Housing Benefit),Very Unlikely,,,,,,,,,,,,,,,,,,,,,,,,I am just about managing financially,,,,,,,,,I am not concerned about any of these issues,,,,4,,0,,No,No,10 - completely,9,10 - completely,4,Hardly ever or never,Hardly ever or never,Some of the time,NHS GP in the Westminster City Council Area,UK,,,,,11 to 15 Years,Warwick,"Multi-ethnic, purpose-built estates",Sensible seniors,54,E00024058,E01004749,0.967598384
4,Female,53,,,50 - 54,Working - Part Time (17 - 29 HRS),,Any - Other White background (type in),Japanese,4,4,4,4,4,2,1: Not at all concerned,4,1: Not at all concerned,1: Not at all concerned,1: Not at all concerned,1: Not at all concerned,Very Satisfied,Fairly Satisfied,Fairly Satisfied,Fairly Satisfied,Fairly Satisfied,Fairly Satisfied,,,,,,,None of these,,TEND TO AGREE,TEND TO AGREE,TEND TO AGREE,TEND TO AGREE,TEND TO AGREE,TEND TO AGREE,TEND TO AGREE,TEND TO AGREE,Internet via computer / laptop,,,,Internet via an Android smartphone,,,,,,,Keeps Us Fairly Well Informed,Keeps Us Fairly Well Informed,Keeps Us Fairly Well Informed,Keeps Us Fairly Well Informed,Keeps Us Fairly Well Informed,,,,,,,,,,,(None of these),,,,,,,,,,,,,By Post or Letter,,Email,Website,,,,Text,,,,,Not a very big problem,A fairly big problem,Not a very big problem,Not a very big problem,Not a very big problem,Not a very big problem,A fairly big problem,A fairly big problem,A fairly big problem,Not a very big problem,Not a very big problem,Not a very big problem,Not a very big problem,A fairly big problem,Not a very big problem,Not a very big problem,Not a very big problem,Not a very big problem,Not a very big problem,Very Safe,Fairly Safe,Not Very Much,Not At All,Not At All,A Great Deal,A Great Deal,Not At All,Not At All,"I have not done this, but I would be willing to start for the benefit of the environment",I have not done this – and I’m unlikely to do so,(Not applicable),(Not applicable),"I have done this, but not primarily for the benefit of the environment","I have done this, but not primarily for the benefit of the environment","I have done this, but not primarily for the benefit of the environment","I have done this, but not primarily for the benefit of the environment",No,,Tend to Agree,Not very much,Rents (With Or Without Housing Benefit),Very Unlikely,,,,,,,,,,,,,,,,,,,,,,,,"I am not really managing financially, and often struggle to make ends meet",,,,Paying other bills or costs,,,,,,,,,2,,0,,No,No,9,10 - completely,10 - completely,5,Hardly ever or never,Hardly ever or never,Hardly ever or never,NHS GP in the Westminster City Council Area,,,"Other (type in, multiple allowed)",,Japanese,More than 20 Years,Warwick,"Multi-ethnic, purpose-built estates",Sensible seniors,54,E00024058,E01004749,0.77238882
5,Female,44,,,35 - 44,"Unemployed, Not Registered-Seeking Work",,Mixed - White and Black - Caribbean,,1: Not at all concerned,1: Not at all concerned,1: Not at all concerned,1: Not at all concerned,1: Not at all concerned,1: Not at all concerned,2,2,1: Not at all concerned,5: Very concerned,5: Very concerned,1: Not at all concerned,Fairly Dissatisfied,Very Satisfied,Fairly Dissatisfied,Fairly Satisfied,Very Dissatisfied,Fairly Dissatisfied,Social Care Services (Adults or Children),,,,,,,,NEITHER AGREE NOR DISAGREE,NEITHER AGREE NOR DISAGREE,TEND TO AGREE,NEITHER AGREE NOR DISAGREE,TEND TO DISAGREE,TEND TO DISAGREE,NEITHER AGREE NOR DISAGREE,NEITHER AGREE NOR DISAGREE,Internet via computer / laptop,Internet via an iPhone,,,Internet via an Android smartphone,,,,,,,Keeps Us Fairly Well Informed,Keeps Us Fairly Well Informed,Keeps Us Fairly Well Informed,Keeps Us Fairly Well Informed,Keeps Us Fairly Well Informed,,,,,,,,,,,(None of these),,,,,,,,,,,,,,,Email,,,,,Text,,,,,Not a very big problem,A fairly big problem,Not a very big problem,Not a problem at all,Not a problem at all,Not a problem at all,A very big problem,A fairly big problem,A fairly big problem,Not a problem at all,A fairly big problem,Not a problem at all,Not a problem at all,A fairly big problem,Not a problem at all,Not a problem at all,Not a problem at all,Not a problem at all,Not a problem at all,Very Safe,A Bit Unsafe,Not Very Much,Not Very Much,Not Very Much,A Great Deal,A Great Deal,Not Very Much,Not Very Much,"I have not done this, but I would be willing to start for the benefit of the environment","I have not done this, but I would be willing to start for the benefit of the environment",(Not applicable),(Not applicable),"I have done this, primarily for the benefit of the environment","I have done this, primarily for the benefit of the environment","I have done this, primarily for the benefit of the environment","I have done this, primarily for the benefit of the environment",No,,Tend to Agree,None at all,Rents (With Or Without Housing Benefit),Very Unlikely,,,,,,,,,,,,,,,,,,,,,,,,I am relatively comfortable financially,,,,,,,,,I am not concerned about any of these issues,,,,2,,1,,Yes,No,9,9,8,9,Hardly ever or never,Hardly ever or never,Hardly ever or never,NHS GP in the Westminster City Council Area,,"Other EU, EEA or Swiss national",,,,Always Lived Here,Warwick,"Multi-ethnic, purpose-built estates",Sensible seniors,54,E00024058,E01004749,1.19627932
