60,Female,59,,,55 - 59,Working - Full Time (30+ HRS),,White - British,,1: Not at all concerned,1: Not at all concerned,1: Not at all concerned,1: Not at all concerned,1: Not at all concerned,1: Not at all concerned,1: Not at all concerned,1: Not at all concerned,1: Not at all concerned,1: Not at all concerned,Not applicable ,1: Not at all concerned,Fairly Satisfied,Very Satisfied,Very Satisfied,Very Satisfied,Fairly Satisfied,Fairly Satisfied,,,,,,,None of these,,STRONGLY AGREE,TEND TO DISAGREE,TEND TO AGREE,(DON’T KNOW/NO OPINION),STRONGLY AGREE,TEND TO AGREE,(DON’T KNOW/NO OPINION),TEND TO DISAGREE,Internet via computer / laptop,Internet via an iPhone,Internet via an iPad,,,Internet via digital / satellite TV,,,,,,Keeps Us Very Well Informed,Keeps Us Very Well Informed,Keeps Us Very Well Informed,Keeps Us Very Well Informed,I don’t need this type of advice,Westminster Reporter (the council’s magazine) - (PICTURE A),,,Council website (www.westminster.gov.uk) - (PICTURE D),MyWestminster e-Newsletter - (PICTURE E),,,,,,,,Very Useful,,,Fairly Useful,Very Useful,,,,,,,,,Email,,,,,,,,,,Not a problem at all,Not a problem at all,Not a problem at all,Not a problem at all,Not a problem at all,Not a problem at all,Not a problem at all,A fairly big problem,A fairly big problem,Not a problem at all,Not a problem at all,Not a problem at all,A fairly big problem,Not a problem at all,Not a problem at all,Not a problem at all,Not a very big problem,Not a very big problem,Not a problem at all,Very Safe,Very Safe,A Fair Amount,A Fair Amount,Not At All,A Great Deal,Not At All,A Fair Amount,Not At All,"I have not done this, but I would be willing to start for the benefit of the environment",(Not applicable),(Not applicable),"I have done this, but not primarily for the benefit of the environment",I have not done this – and I’m unlikely to do so,"I have done this, primarily for the benefit of the environment","I have done this, but not primarily for the benefit of the environment","I have done this, but not primarily for the benefit of the environment",No,,All in Local Area are the same background,None at all,Owns Outright,Very Unlikely,,,,,,,,,,,,,,,,,,,,,,,,I am very comfortable financially,,,,,,,,,I am not concerned about any of these issues,,,,4,,0,,No,No,8,9,8,3,Hardly ever or never,Hardly ever or never,Hardly ever or never,NHS GP in the Westminster City Council Area,UK,"Other EU, EEA or Swiss national",,,,Always Lived Here,Abbey Road,Metropolitan money,Gym & juices,2,E00023448,E01004648,0.77238882
61,Male,29,,,25 - 34,Working - Part Time (8 - 16 HRS),,Other Ethnic groups - Arab,,5: Very concerned,5: Very concerned,5: Very concerned,5: Very concerned,5: Very concerned,Not applicable ,5: Very concerned,5: Very concerned,5: Very concerned,5: Very concerned,Not applicable ,5: Very concerned,Very Satisfied,Neither Satisfied Nor Dissatisfied,Fairly Satisfied,Fairly Satisfied,Fairly Satisfied,Neither Satisfied Nor Dissatisfied,,,,,,,,Prefer not to say,NEITHER AGREE NOR DISAGREE,NEITHER AGREE NOR DISAGREE,NEITHER AGREE NOR DISAGREE,NEITHER AGREE NOR DISAGREE,TEND TO AGREE,TEND TO AGREE,TEND TO AGREE,TEND TO AGREE,Internet via computer / laptop,,,,,,,,,,,Keeps Us Fairly Well Informed,Keeps Us Fairly Well Informed,Keeps Us Fairly Well Informed,Keeps Us Fairly Well Informed,Keeps Us Fairly Well Informed,Westminster Reporter (the council’s magazine) - (PICTURE A),,,Council website (www.westminster.gov.uk) - (PICTURE D),,,,,,,,,Fairly Useful,,,Very Useful,,,,,,,,,,,Website,,,,,,,,,A fairly big problem,A very big problem,A very big problem,A fairly big problem,A very big problem,A very big problem,A very big problem,A very big problem,A very big problem,A fairly big problem,A very big problem,A very big problem,Not a very big problem,Not a very big problem,A very big problem,(Don't know),A fairly big problem,Not a problem at all,Not a very big problem,Fairly Safe,Fairly Safe,A Great Deal,Not Very Much,Not At All,A Great Deal,A Great Deal,Not At All,A Great Deal,"I have done this, primarily for the benefit of the environment","I have not done this, but I would be willing to start for the benefit of the environment","I have done this, but not primarily for the benefit of the environment","I have done this, but not primarily for the benefit of the environment","I have done this, primarily for the benefit of the environment","I have done this, primarily for the benefit of the environment","I have done this, but not primarily for the benefit of the environment","I have done this, primarily for the benefit of the environment",No,,Tend to Agree,A fair amount,Rents (With Or Without Housing Benefit),Very Unlikely,,,,,,,,,,,,,,,,,,,,,,,,I am just about managing financially,"Paying fuel bills (eg gas, electricity)",Paying the rent/mortgage,,Paying other bills or costs,,,,,,,,,5,,0,,Yes,"Yes, Limited a lot",6,6,4,8,Some of the time,Often,Some of the time,NHS GP in the Westminster City Council Area,UK,,,,,More than 20 Years,Church Street,Deprived and ethnically diverse in flats,Despondent diversity,55,E00175272,E01033598,1.016170699
62,Female,16,,,16 - 24,Full-Time Student,,Asian or Asian British - Bangladeshi,,1: Not at all concerned,2,Not applicable ,2,1: Not at all concerned,1: Not at all concerned,1: Not at all concerned,1: Not at all concerned,1: Not at all concerned,1: Not at all concerned,2,1: Not at all concerned,Fairly Satisfied,Very Satisfied,Very Satisfied,Very Satisfied,Neither Satisfied Nor Dissatisfied,Fairly Satisfied,,,,,,,None of these,,TEND TO AGREE,STRONGLY AGREE,STRONGLY AGREE,TEND TO AGREE,STRONGLY AGREE,STRONGLY AGREE,STRONGLY AGREE,STRONGLY AGREE,Internet via computer / laptop,Internet via an iPhone,,,,Internet via digital / satellite TV,,,,,,Keeps Us Very Well Informed,Keeps Us Very Well Informed,Keeps Us Very Well Informed,Keeps Us Very Well Informed,Keeps Us Very Well Informed,Westminster Reporter (the council’s magazine) - (PICTURE A),,,Council website (www.westminster.gov.uk) - (PICTURE D),,,,,YourHome Magazine (the council’s magazine for Westminster housing residents) - (PICTURE I),,,,Fairly Useful,,,Very Useful,,,,,Fairly Useful,,,By Post or Letter,,Email,Website,,,,,,,,,A fairly big problem,A very big problem,A very big problem,Not a very big problem,A very big problem,(Don't know),A very big problem,A fairly big problem,A very big problem,(Don't know),A very big problem,A very big problem,A fairly big problem,A very big problem,Not a very big problem,Not a very big problem,A fairly big problem,Not a problem at all,Not a problem at all,Very Safe,Fairly Safe,A Great Deal,A Great Deal,(Don't know),A Great Deal,A Great Deal,(Don't know),(Don't know),(Not applicable),(Not applicable),(Not applicable),(Not applicable),(Not applicable),(Not applicable),(Not applicable),(Not applicable),No,,(Don't know),A fair amount,Rents A Room In A Shared Property,Very Unlikely,,,,,,,,,,,,,,,,,,,,,,,,Not sure,,,,,,,,,,,(Don't know),,5,,1,,No,No,5,5,5,5,Some of the time,Some of the time,Some of the time,NHS GP in the Westminster City Council Area,UK,,,,,16 to 20 Years,Church Street,Deprived and ethnically diverse in flats,Despondent diversity,55,E00175265,E01033598,1.144114173
63,Male,54,,,50 - 54,Working - Full Time (30+ HRS),,Black or Black British - Caribbean,,4,4,5: Very concerned,5: Very concerned,3,Not applicable ,5: Very concerned,4,4,4,Not applicable ,3,Very Satisfied,Very Satisfied,Very Satisfied,Very Satisfied,Very Satisfied,Very Satisfied,,,,,,,None of these,,TEND TO AGREE,NEITHER AGREE NOR DISAGREE,TEND TO AGREE,TEND TO AGREE,STRONGLY AGREE,TEND TO AGREE,STRONGLY AGREE,TEND TO AGREE,Internet via computer / laptop,Internet via an iPhone,,,,,,,,,,Keeps Us Very Well Informed,Keeps Us Fairly Well Informed,Keeps Us Very Well Informed,Keeps Us Very Well Informed,Gives us only a Limited Amount of Information,Westminster Reporter (the council’s magazine) - (PICTURE A),,,Council website (www.westminster.gov.uk) - (PICTURE D),,,"Westminster City Save website, brochure or card (the council’s discount scheme www. westminster.gov.uk/citysave - (PICTURE G)",,,,,,Very Useful,,,Very Useful,,,Fairly Useful,,,,By publication,,,Email,Website,,Facebook,,Text,,,,,Not a very big problem,A fairly big problem,Not a very big problem,Not a problem at all,Not a very big problem,Not a very big problem,A very big problem,A fairly big problem,A very big problem,Not a very big problem,A fairly big problem,A fairly big problem,A fairly big problem,Not a problem at all,A fairly big problem,Not a very big problem,Not a very big problem,Not a very big problem,Not a problem at all,Very Safe,Very Safe,A Fair Amount,Not At All,Not At All,A Great Deal,A Great Deal,Not At All,Not At All,"I have done this, but not primarily for the benefit of the environment",I have not done this – and I’m unlikely to do so,I have not done this – and I’m unlikely to do so,I have not done this – and I’m unlikely to do so,"I have done this, primarily for the benefit of the environment","I have done this, primarily for the benefit of the environment",I have not done this – and I’m unlikely to do so,"I have done this, primarily for the benefit of the environment",No,,Definitely Agree,None at all,Rents (With Or Without Housing Benefit),Very Unlikely,,,,,,,,,,,,,,,,,,,,,,,,I am just about managing financially,,,,,,,Paying credit card bills,Paying loans,,,,,1,,0,,No,No,5,4,6,6,Some of the time,Some of the time,Some of the time,NHS GP in the Westminster City Council Area,UK,,,,,More than 20 Years,Church Street,Deprived and ethnically diverse in flats,Despondent diversity,55,E00175272,E01033598,0.832921997
64,Male,68,,,65 - 74,Retired,,White - Irish,,3,4,Not applicable ,2,1: Not at all concerned,Not applicable ,2,4,3,3,Not applicable ,4,Fairly Satisfied,Fairly Satisfied,Fairly Satisfied,Very Satisfied,Fairly Satisfied,Fairly Satisfied,,,Special Educational Needs,Homelessness Services,,,,,TEND TO AGREE,(DON’T KNOW/NO OPINION),TEND TO DISAGREE,NEITHER AGREE NOR DISAGREE,TEND TO AGREE,TEND TO AGREE,TEND TO AGREE,TEND TO AGREE,,,,,,,,,None of these,,,Keeps Us Fairly Well Informed,Keeps Us Fairly Well Informed,Keeps Us Fairly Well Informed,Keeps Us Fairly Well Informed,Keeps Us Fairly Well Informed,Westminster Reporter (the council’s magazine) - (PICTURE A),Westminster Plus (magazine for older people) - (PICTURE B),Your council tax – providing an A-Z of the local services most important to you (delivered with your council tax bill in March 2020) - (PICTURE C),,,,,,,,,,Very Useful,Very Useful,Very Useful,,,,,,,,,By Post or Letter,,,,,,,,,,,,A fairly big problem,A very big problem,A fairly big problem,Not a problem at all,Not a very big problem,A fairly big problem,A very big problem,A fairly big problem,A fairly big problem,Not a very big problem,A fairly big problem,A very big problem,A fairly big problem,Not a problem at all,Not a very big problem,Not a very big problem,A fairly big problem,A fairly big problem,Not a problem at all,Fairly Safe,Fairly Safe,Not At All,Not At All,Not At All,A Fair Amount,A Great Deal,Not At All,A Fair Amount,"I have done this, primarily for the benefit of the environment",I have not done this – and I’m unlikely to do so,I have not done this – and I’m unlikely to do so,I have not done this – and I’m unlikely to do so,I have not done this – and I’m unlikely to do so,"I have done this, primarily for the benefit of the environment",I have not done this – and I’m unlikely to do so,"I have done this, primarily for the benefit of the environment",No,,Definitely Agree,A fair amount,Rents (With Or Without Housing Benefit),Very Unlikely,,,,,,,,,,,,,,,,,,,,,,,,I am just about managing financially,,,,,,,,,I am not concerned about any of these issues,,,,2,,0,,Yes,No,8,5,8,7,Hardly ever or never,Hardly ever or never,Hardly ever or never,NHS GP in the Westminster City Council Area,UK,"Other EU, EEA or Swiss national",,,,More than 20 Years,Church Street,Deprived and ethnically diverse in flats,Despondent diversity,55,E00175265,E01033598,1.143251357
65,Female,53,,,50 - 54,"Unemployed, Not Registered-Seeking Work",,Asian or Asian British - Bangladeshi,,4,5: Very concerned,Not applicable ,5: Very concerned,3,Not applicable ,5: Very concerned,4,5: Very concerned,4,4,5: Very concerned,Fairly Satisfied,Very Satisfied,Very Satisfied,Fairly Satisfied,Very Satisfied,Fairly Satisfied,,,,,,,None of these,,TEND TO AGREE,TEND TO AGREE,STRONGLY AGREE,NEITHER AGREE NOR DISAGREE,TEND TO AGREE,TEND TO AGREE,TEND TO AGREE,(DON’T KNOW/NO OPINION),Internet via computer / laptop,,,Internet via other tablet,Internet via an Android smartphone,,,,,,,Keeps Us Fairly Well Informed,Keeps Us Fairly Well Informed,Keeps Us Fairly Well Informed,Keeps Us Fairly Well Informed,Keeps Us Fairly Well Informed,Westminster Reporter (the council’s magazine) - (PICTURE A),,,Council website (www.westminster.gov.uk) - (PICTURE D),,,,,YourHome Magazine (the council’s magazine for Westminster housing residents) - (PICTURE I),,,,Fairly Useful,,,Fairly Useful,,,,,Fairly Useful,,By publication,,,Email,Website,,,Instagram,,,,,,Not a very big problem,A fairly big problem,A fairly big problem,Not a problem at all,A fairly big problem,A fairly big problem,A very big problem,A fairly big problem,A very big problem,Not a problem at all,A fairly big problem,A fairly big problem,A fairly big problem,Not a problem at all,A fairly big problem,Not a very big problem,A fairly big problem,A fairly big problem,Not a problem at all,Fairly Safe,Fairly Safe,Not Very Much,Not At All,Not At All,A Great Deal,A Great Deal,Not At All,Not Very Much,"I have done this, primarily for the benefit of the environment","I have not done this, but I would be willing to start for the benefit of the environment","I have done this, but not primarily for the benefit of the environment","I have not done this, but I would be willing to start for the benefit of the environment","I have done this, but not primarily for the benefit of the environment","I have done this, primarily for the benefit of the environment",(Not applicable),"I have done this, primarily for the benefit of the environment",No,,Definitely Agree,A fair amount,Rents (With Or Without Housing Benefit),Very Unlikely,,,,,,,,,,,,,,,,,,,,,,,,I am relatively comfortable financially,,,,,,,,,I am not concerned about any of these issues,,,,4,,0,,No,No,4,5,7,6,Hardly ever or never,Hardly ever or never,Hardly ever or never,NHS GP in the Westminster City Council Area,UK,,,,,More than 20 Years,Church Street,Deprived and ethnically diverse in flats,Despondent diversity,55,E00175265,E01033598,0.909275959
66,Female,43,,,35 - 44,"Unemployed, Not Registered-Seeking Work",,Asian or Asian British - Bangladeshi,,3,4,Not applicable ,5: Very concerned,5: Very concerned,Not applicable ,5: Very concerned,5: Very concerned,4,3,5: Very concerned,4,Very Satisfied,Very Satisfied,Very Satisfied,Fairly Satisfied,Fairly Satisfied,Fairly Satisfied,,,,,,,None of these,,(DON’T KNOW/NO OPINION),TEND TO AGREE,NEITHER AGREE NOR DISAGREE,(DON’T KNOW/NO OPINION),TEND TO AGREE,TEND TO AGREE,TEND TO AGREE,TEND TO AGREE,,,,,,,,,None of these,,,Keeps Us Very Well Informed,Keeps Us Fairly Well Informed,Keeps Us Fairly Well Informed,Keeps Us Fairly Well Informed,Keeps Us Fairly Well Informed,Westminster Reporter (the council’s magazine) - (PICTURE A),,,,,,,,,,,,Very Useful,,,,,,,,,,,By Post or Letter,,,,,,,,,,,,Not a very big problem,Not a very big problem,Not a problem at all,A fairly big problem,A very big problem,A fairly big problem,A fairly big problem,A fairly big problem,A fairly big problem,Not a very big problem,A fairly big problem,A very big problem,A fairly big problem,Not a very big problem,Not a very big problem,A fairly big problem,Not a very big problem,Not a very big problem,(Don't know),Very Safe,Fairly Safe,Not Very Much,Not At All,Not At All,A Great Deal,A Great Deal,Not At All,Not At All,"I have done this, but not primarily for the benefit of the environment","I have not done this, but I would be willing to start for the benefit of the environment","I have done this, primarily for the benefit of the environment",I have not done this – and I’m unlikely to do so,"I have done this, primarily for the benefit of the environment","I have done this, but not primarily for the benefit of the environment","I have done this, but not primarily for the benefit of the environment","I have done this, but not primarily for the benefit of the environment",No,,Definitely Agree,Not very much,Rents (With Or Without Housing Benefit),Very Unlikely,,,,,,,,,,,,,,,,,,,,,,,,I am just about managing financially,,,,,,,,,I am not concerned about any of these issues,,,,5,,1,,No,No,5,6,6,6,Hardly ever or never,Some of the time,Hardly ever or never,NHS GP in the Westminster City Council Area,UK,,,,,16 to 20 Years,Church Street,Deprived and ethnically diverse in flats,Despondent diversity,55,E00175272,E01033598,1.19627932
67,Female,36,,,35 - 44,Working - Full Time (30+ HRS),,Any - Other White background (type in),ITALIAN,4,4,3,4,2,Not applicable ,3,3,4,4,Not applicable ,4,Fairly Satisfied,Very Satisfied,Fairly Satisfied,Fairly Satisfied,Fairly Satisfied,Neither Satisfied Nor Dissatisfied,,,,,,,None of these,,TEND TO AGREE,TEND TO DISAGREE,NEITHER AGREE NOR DISAGREE,TEND TO DISAGREE,NEITHER AGREE NOR DISAGREE,NEITHER AGREE NOR DISAGREE,TEND TO AGREE,(DON’T KNOW/NO OPINION),Internet via computer / laptop,Internet via an iPhone,,,,,,,,,,Keeps Us Fairly Well Informed,Gives us only a Limited Amount of Information,Keeps Us Fairly Well Informed,Keeps Us Fairly Well Informed,Gives us only a Limited Amount of Information,Westminster Reporter (the council’s magazine) - (PICTURE A),,Your council tax – providing an A-Z of the local services most important to you (delivered with your council tax bill in March 2020) - (PICTURE C),,,,,,,,,,Fairly Useful,,Fairly Useful,,,,,,,,,By Post or Letter,,,,,,,,,,,,A fairly big problem,A fairly big problem,A fairly big problem,Not a problem at all,A fairly big problem,A fairly big problem,A very big problem,A fairly big problem,A fairly big problem,Not a very big problem,A fairly big problem,A very big problem,A very big problem,Not a problem at all,A fairly big problem,Not a very big problem,A fairly big problem,Not a very big problem,Not a problem at all,Fairly Safe,A Bit Unsafe,Not At All,A Fair Amount,Not At All,A Great Deal,A Great Deal,Not At All,Not Very Much,(Not applicable),(Not applicable),(Not applicable),(Not applicable),"I have done this, but not primarily for the benefit of the environment","I have done this, primarily for the benefit of the environment","I have done this, primarily for the benefit of the environment","I have done this, primarily for the benefit of the environment",No,,Tend to Agree,None at all,Rents (With Or Without Housing Benefit),Very Unlikely,,,,,,,,,,,,,,,,,,,,,,,,I am just about managing financially,,,,,,,Paying credit card bills,Paying loans,,,,,3,,0,,No,No,8,7,6,5,Some of the time,Some of the time,Some of the time,NHS GP in the Westminster City Council Area,,"Other EU, EEA or Swiss national",,,,6 to 10 Years,Church Street,Deprived and ethnically diverse in flats,Despondent diversity,55,E00175272,E01033598,0.967598384
68,Male,28,,,25 - 34,Working - Full Time (30+ HRS),,White - Eastern European (type in),FINLAND,5: Very concerned,5: Very concerned,4,4,3,3,3,4,4,4,Not applicable ,4,Neither Satisfied Nor Dissatisfied,Neither Satisfied Nor Dissatisfied,Fairly Satisfied,Fairly Satisfied,Neither Satisfied Nor Dissatisfied,Neither Satisfied Nor Dissatisfied,,,,,,,None of these,,NEITHER AGREE NOR DISAGREE,TEND TO DISAGREE,TEND TO DISAGREE,(DON’T KNOW/NO OPINION),NEITHER AGREE NOR DISAGREE,TEND TO AGREE,TEND TO DISAGREE,(DON’T KNOW/NO OPINION),Internet via computer / laptop,Internet via an iPhone,,,,,,,,,,Gives us only a Limited Amount of Information,Gives us only a Limited Amount of Information,Gives us only a Limited Amount of Information,Gives us only a Limited Amount of Information,Gives us only a Limited Amount of Information,Westminster Reporter (the council’s magazine) - (PICTURE A),,,Council website (www.westminster.gov.uk) - (PICTURE D),,,,,,,,,Fairly Useful,,,Not very useful,,,,,,,,By Post or Letter,,,,,,,,,,,,A fairly big problem,A fairly big problem,A fairly big problem,A fairly big problem,A very big problem,A very big problem,A very big problem,A very big problem,A very big problem,Not a very big problem,A very big problem,A very big problem,A fairly big problem,Not a very big problem,A fairly big problem,Not a very big problem,A very big problem,Not a very big problem,Not a very big problem,A Bit Unsafe,A Bit Unsafe,Not At All,Not At All,Not At All,A Great Deal,A Great Deal,A Great Deal,Not At All,"I have done this, primarily for the benefit of the environment",(Not applicable),(Not applicable),(Not applicable),(Not applicable),"I have done this, primarily for the benefit of the environment","I have done this, primarily for the benefit of the environment","I have done this, primarily for the benefit of the environment",No,,Neither Agree Nor Disagree,Not very much,Rents (With Or Without Housing Benefit),Don’t Know,,,,,,,,,,,,,,,,,,,,,,,,Not sure,,,,,,,,,,,(Don't know),,4,,0,,No,No,6,6,6,5,Hardly ever or never,Hardly ever or never,Some of the time,None of these,,"Other EU, EEA or Swiss national",,,,3 to 5 Years,Church Street,Deprived and ethnically diverse in flats,Despondent diversity,55,E00175265,E01033598,1.016170699
69,Male,40,,,35 - 44,Working - Part Time (8 - 16 HRS),,Other Ethnic groups - Arab,,5: Very concerned,5: Very concerned,5: Very concerned,5: Very concerned,5: Very concerned,Not applicable ,5: Very concerned,5: Very concerned,Not applicable ,Not applicable ,5: Very concerned,Not applicable ,Very Satisfied,Fairly Satisfied,Fairly Satisfied,Neither Satisfied Nor Dissatisfied,Fairly Satisfied,Neither Satisfied Nor Dissatisfied,,Westminster Employment Services,,,,,,,STRONGLY AGREE,TEND TO AGREE,TEND TO AGREE,TEND TO AGREE,TEND TO AGREE,TEND TO AGREE,TEND TO AGREE,TEND TO AGREE,Internet via computer / laptop,Internet via an iPhone,Internet via an iPad,Internet via other tablet,,,,,,,,Keeps Us Fairly Well Informed,Keeps Us Very Well Informed,Keeps Us Fairly Well Informed,Keeps Us Fairly Well Informed,Keeps Us Fairly Well Informed,,Westminster Plus (magazine for older people) - (PICTURE B),,,MyWestminster e-Newsletter - (PICTURE E),,,,,,,,,Fairly Useful,,,Fairly Useful,,,,,,,By Post or Letter,,,,,,,,,,,,A very big problem,A very big problem,Not a very big problem,Not a very big problem,Not a problem at all,Not a problem at all,Not a problem at all,A fairly big problem,A fairly big problem,A very big problem,A very big problem,A very big problem,A very big problem,Not a problem at all,Not a very big problem,Not a problem at all,A very big problem,A very big problem,Not a problem at all,Very Safe,Fairly Safe,Not At All,Not At All,Not At All,A Great Deal,A Fair Amount,A Fair Amount,Not Very Much,"I have not done this, but I would be willing to start for the benefit of the environment",(Not applicable),(Not applicable),(Not applicable),"I have done this, primarily for the benefit of the environment","I have done this, primarily for the benefit of the environment","I have not done this, but I would be willing to start for the benefit of the environment","I have done this, primarily for the benefit of the environment",No,,Definitely Agree,None at all,Rents (With Or Without Housing Benefit),Very Unlikely,,,,,,,,,,,,,,,,,,,,,,,,I am just about managing financially,,,,,,,,,I am not concerned about any of these issues,,,,5,,3,,No,No,10 - completely,10 - completely,10 - completely,0 - not at all,Hardly ever or never,Hardly ever or never,Hardly ever or never,NHS GP in the Westminster City Council Area,,,"Other (type in, multiple allowed)",,Kuwait,11 to 15 Years,Bayswater,Metropolitan professionals,Gym & juices,16,E00023481,E01004653,1.016170699
