211,Male,,Refused exact age,45-49,45 - 49,Working - Full Time (30+ HRS),,Black or Black British - Caribbean,,2,2,1: Not at all concerned,2,2,2,1: Not at all concerned,2,3,2,3,2,Fairly Satisfied,Fairly Satisfied,Fairly Satisfied,Fairly Satisfied,Fairly Satisfied,Very Satisfied,,,,,,,None of these,,TEND TO AGREE,TEND TO AGREE,TEND TO AGREE,TEND TO AGREE,TEND TO AGREE,TEND TO AGREE,TEND TO AGREE,TEND TO AGREE,Internet via computer / laptop,Internet via an iPhone,,,,,,,,,,Keeps Us Fairly Well Informed,Keeps Us Fairly Well Informed,Keeps Us Fairly Well Informed,Keeps Us Fairly Well Informed,Keeps Us Fairly Well Informed,Westminster Reporter (the council’s magazine) - (PICTURE A),Westminster Plus (magazine for older people) - (PICTURE B),,,,,,,,,,,Very Useful,Very Useful,,,,,,,,,By publication,By Post or Letter,,Email,,,,,,,,,,Not a problem at all,Not a problem at all,Not a problem at all,Not a problem at all,Not a problem at all,Not a problem at all,Not a problem at all,Not a problem at all,Not a problem at all,Not a problem at all,Not a problem at all,Not a problem at all,Not a problem at all,Not a problem at all,Not a problem at all,Not a problem at all,Not a problem at all,Not a problem at all,Not a problem at all,Very Safe,Very Safe,A Great Deal,Not At All,Not At All,A Great Deal,A Great Deal,Not Very Much,A Fair Amount,"I have not done this, but I would be willing to start for the benefit of the environment","I have done this, but not primarily for the benefit of the environment","I have not done this, but I would be willing to start for the benefit of the environment","I have not done this, but I would be willing to start for the benefit of the environment","I have done this, but not primarily for the benefit of the environment","I have done this, but not primarily for the benefit of the environment","I have done this, but not primarily for the benefit of the environment","I have done this, but not primarily for the benefit of the environment",No,,Tend to Agree,A fair amount,Rents (With Or Without Housing Benefit),Very Unlikely,,,,,,,,,,,,,,,,,,,,,,,,I am relatively comfortable financially,,,,,,,,,I am not concerned about any of these issues,,,,2,,0,,No,No,9,8,7,1,Hardly ever or never,Hardly ever or never,Hardly ever or never,NHS GP in the Westminster City Council Area,UK,,,,,Always Lived Here,Bayswater,Metropolitan professionals,Cultural concerns,16,E00023468,E01004653,1.016170699
212,Female,32,,,25 - 34,Working - Full Time (30+ HRS),,White - Western European (type in),France,2,4,3,4,2,Not applicable ,3,4,3,4,4,3,Fairly Satisfied,Neither Satisfied Nor Dissatisfied,Fairly Dissatisfied,Fairly Satisfied,Fairly Satisfied,Fairly Satisfied,,,,,,,None of these,,NEITHER AGREE NOR DISAGREE,NEITHER AGREE NOR DISAGREE,TEND TO AGREE,NEITHER AGREE NOR DISAGREE,NEITHER AGREE NOR DISAGREE,TEND TO AGREE,NEITHER AGREE NOR DISAGREE,NEITHER AGREE NOR DISAGREE,Internet via computer / laptop,Internet via an iPhone,,,,Internet via digital / satellite TV,,,,,,Keeps Us Fairly Well Informed,Doesn't Tell Us Much At All,Doesn't Tell Us Much At All,Doesn't Tell Us Much At All,Doesn't Tell Us Much At All,Westminster Reporter (the council’s magazine) - (PICTURE A),,,,,,,,,,,,Fairly Useful,,,,,,,,,,,By Post or Letter,,,,,,,,,,,,A very big problem,Not a very big problem,Not a very big problem,Not a very big problem,Not a very big problem,Not a very big problem,Not a very big problem,Not a very big problem,Not a very big problem,Not a very big problem,Not a very big problem,Not a very big problem,A fairly big problem,Not a very big problem,A fairly big problem,Not a very big problem,Not a very big problem,Not a very big problem,Not a very big problem,Fairly Safe,Fairly Safe,A Fair Amount,Not At All,Not At All,A Great Deal,Not Very Much,Not At All,Not At All,"I have not done this, but I would be willing to start for the benefit of the environment","I have not done this, but I would be willing to start for the benefit of the environment","I have not done this, but I would be willing to start for the benefit of the environment","I have not done this, but I would be willing to start for the benefit of the environment","I have not done this, but I would be willing to start for the benefit of the environment","I have not done this, but I would be willing to start for the benefit of the environment","I have not done this, but I would be willing to start for the benefit of the environment","I have not done this, but I would be willing to start for the benefit of the environment",No,,Tend to Agree,None at all,Owns Outright,Very Unlikely,,,,,,,,,,,,,,,,,,,,,,,,I am relatively comfortable financially,,,,,,,,,I am not concerned about any of these issues,,,,3,,0,,No,No,9,8,7,1,Hardly ever or never,Hardly ever or never,Hardly ever or never,NHS GP in the Westminster City Council Area,,"Other EU, EEA or Swiss national",,,,16 to 20 Years,Bayswater,Metropolitan professionals,Cultural concerns,16,E00023468,E01004653,0.967598384
213,Female,70,,,65 - 74,Retired,,White - British,,2,4,Not applicable ,5: Very concerned,2,Not applicable ,4,3,1: Not at all concerned,2,Not applicable ,1: Not at all concerned,Fairly Satisfied,Fairly Satisfied,Fairly Satisfied,Fairly Satisfied,Fairly Satisfied,Fairly Satisfied,,,,,,,None of these,,TEND TO AGREE,TEND TO DISAGREE,NEITHER AGREE NOR DISAGREE,NEITHER AGREE NOR DISAGREE,NEITHER AGREE NOR DISAGREE,TEND TO AGREE,NEITHER AGREE NOR DISAGREE,TEND TO AGREE,Internet via computer / laptop,Internet via an iPhone,Internet via an iPad,,,,,,,,,Keeps Us Very Well Informed,Keeps Us Very Well Informed,Keeps Us Very Well Informed,Keeps Us Very Well Informed,Keeps Us Very Well Informed,Westminster Reporter (the council’s magazine) - (PICTURE A),Westminster Plus (magazine for older people) - (PICTURE B),,,,,,,,,,,Fairly Useful,Fairly Useful,,,,,,,,,By publication,,,,,,,,,,,,,Not a problem at all,Not a problem at all,Not a problem at all,Not a problem at all,Not a problem at all,Not a problem at all,Not a problem at all,Not a very big problem,Not a very big problem,Not a problem at all,Not a problem at all,A fairly big problem,A very big problem,Not a problem at all,A fairly big problem,Not a problem at all,A fairly big problem,Not a problem at all,Not a problem at all,Very Safe,Very Safe,A Great Deal,Not At All,A Fair Amount,A Great Deal,A Great Deal,A Fair Amount,A Fair Amount,"I have not done this, but I would be willing to start for the benefit of the environment","I have not done this, but I would be willing to start for the benefit of the environment","I have not done this, but I would be willing to start for the benefit of the environment","I have not done this, but I would be willing to start for the benefit of the environment","I have not done this, but I would be willing to start for the benefit of the environment","I have not done this, but I would be willing to start for the benefit of the environment","I have not done this, but I would be willing to start for the benefit of the environment","I have not done this, but I would be willing to start for the benefit of the environment",No,,Definitely Agree,A fair amount,Owns Outright,Very Unlikely,,,,,,,,,,,,,,,,,,,,,,,,I am very comfortable financially,,,,,,,,,I am not concerned about any of these issues,,,,5,,0,,No,No,9,9,9,1,Hardly ever or never,Hardly ever or never,Hardly ever or never,NHS GP in the Westminster City Council Area,UK,,,,,Always Lived Here,Bayswater,Metropolitan professionals,Cultural concerns,16,E00023468,E01004653,1.077531553
214,Male,,Refused exact age,16-24,16 - 24,Full-Time Student,,Asian or Asian British - Any other Asian Background (type in),Libya and England,2,2,2,2,2,2,2,2,2,2,2,2,Fairly Satisfied,Fairly Satisfied,Neither Satisfied Nor Dissatisfied,Fairly Satisfied,Neither Satisfied Nor Dissatisfied,Fairly Satisfied,,,,,,,,Prefer not to say,TEND TO AGREE,TEND TO AGREE,TEND TO AGREE,(DON’T KNOW/NO OPINION),(DON’T KNOW/NO OPINION),TEND TO AGREE,TEND TO AGREE,TEND TO AGREE,Internet via computer / laptop,Internet via an iPhone,Internet via an iPad,,,,,,,,,Gives us only a Limited Amount of Information,Gives us only a Limited Amount of Information,Gives us only a Limited Amount of Information,Gives us only a Limited Amount of Information,Gives us only a Limited Amount of Information,,Westminster Plus (magazine for older people) - (PICTURE B),,,,,,,,,,,,Fairly Useful,,,,,,,,,,By Post or Letter,,,Website,,,,,,,,,A fairly big problem,Not a problem at all,Not a problem at all,Not a problem at all,Not a problem at all,Not a problem at all,Not a problem at all,A fairly big problem,Not a problem at all,Not a problem at all,Not a problem at all,Not a problem at all,Not a problem at all,Not a very big problem,Not a problem at all,Not a problem at all,Not a problem at all,Not a very big problem,Not a problem at all,Very Safe,Very Safe,A Great Deal,Not At All,Not At All,A Great Deal,A Great Deal,A Great Deal,Not Very Much,"I have not done this, but I would be willing to start for the benefit of the environment","I have not done this, but I would be willing to start for the benefit of the environment","I have not done this, but I would be willing to start for the benefit of the environment","I have not done this, but I would be willing to start for the benefit of the environment","I have not done this, but I would be willing to start for the benefit of the environment","I have not done this, but I would be willing to start for the benefit of the environment","I have not done this, but I would be willing to start for the benefit of the environment","I have not done this, but I would be willing to start for the benefit of the environment",No,,Tend to Agree,None at all,Rents (With Or Without Housing Benefit),Fairly Unlikely,,,,,,,,,,,,,,,,,,,,,,,,I am relatively comfortable financially,,,,,,,,,I am not concerned about any of these issues,,,,4,,1,,No,No,8,8,7,1,Hardly ever or never,Hardly ever or never,Hardly ever or never,NHS GP in the Westminster City Council Area,UK,,,,,Always Lived Here,Bryanston and Dorset Square,Mixed metropolitan areas,Gym & juices,20,E00023487,E01004661,1.200536928
215,Female,24,,,16 - 24,Working - Full Time (30+ HRS),,White - British,,5: Very concerned,4,4,4,1: Not at all concerned,1: Not at all concerned,3,3,5: Very concerned,5: Very concerned,Not applicable ,4,Very Satisfied,Very Satisfied,Fairly Satisfied,Very Satisfied,Very Satisfied,Very Satisfied,,,,,,,None of these,,TEND TO AGREE,TEND TO AGREE,NEITHER AGREE NOR DISAGREE,STRONGLY AGREE,TEND TO AGREE,NEITHER AGREE NOR DISAGREE,TEND TO DISAGREE,TEND TO DISAGREE,Internet via computer / laptop,Internet via an iPhone,Internet via an iPad,,,Internet via digital / satellite TV,,,,,,Gives us only a Limited Amount of Information,Gives us only a Limited Amount of Information,Gives us only a Limited Amount of Information,Gives us only a Limited Amount of Information,Gives us only a Limited Amount of Information,,,,,,,,,,,(None of these),,,,,,,,,,,,,,,,Website,,,,,,,,,Not a problem at all,Not a problem at all,Not a problem at all,Not a problem at all,Not a problem at all,Not a problem at all,Not a problem at all,A fairly big problem,Not a very big problem,Not a problem at all,Not a very big problem,Not a problem at all,A fairly big problem,Not a problem at all,A fairly big problem,Not a problem at all,Not a very big problem,Not a problem at all,Not a problem at all,Very Safe,Very Safe,Not At All,Not At All,Not At All,A Great Deal,A Great Deal,Not At All,Not Very Much,"I have not done this, but I would be willing to start for the benefit of the environment","I have not done this, but I would be willing to start for the benefit of the environment","I have not done this, but I would be willing to start for the benefit of the environment","I have not done this, but I would be willing to start for the benefit of the environment","I have not done this, but I would be willing to start for the benefit of the environment","I have not done this, but I would be willing to start for the benefit of the environment","I have not done this, but I would be willing to start for the benefit of the environment","I have not done this, but I would be willing to start for the benefit of the environment",No,,Tend to Disagree,Not very much,Owns Outright,Very Unlikely,,,,,,,,,,,,,,,,,,,,,,,,I am very comfortable financially,,,,,,,,,I am not concerned about any of these issues,,,,3,,0,,No,No,8,8,8,1,Hardly ever or never,Hardly ever or never,Hardly ever or never,NHS GP in the Westminster City Council Area,UK,,,,,Always Lived Here,Bayswater,Metropolitan professionals,Cultural concerns,16,E00023468,E01004653,0.894843959
216,Female,29,,,25 - 34,Working - Full Time (30+ HRS),,White - British,,2,2,2,2,2,2,2,2,2,2,Not applicable ,2,Very Satisfied,Very Satisfied,Fairly Satisfied,Fairly Satisfied,Fairly Satisfied,Fairly Satisfied,,,,,,,None of these,,TEND TO AGREE,TEND TO AGREE,TEND TO AGREE,TEND TO AGREE,TEND TO AGREE,TEND TO AGREE,TEND TO AGREE,TEND TO AGREE,,,,,,,,,None of these,,,Keeps Us Fairly Well Informed,Keeps Us Fairly Well Informed,Keeps Us Fairly Well Informed,Keeps Us Fairly Well Informed,Keeps Us Fairly Well Informed,Westminster Reporter (the council’s magazine) - (PICTURE A),Westminster Plus (magazine for older people) - (PICTURE B),,,,,,,,,,,Very Useful,Very Useful,,,,,,,,,,By Post or Letter,,,,,,,,,,,,Not a problem at all,Not a problem at all,Not a problem at all,Not a problem at all,Not a problem at all,Not a problem at all,Not a problem at all,Not a problem at all,Not a problem at all,Not a problem at all,Not a problem at all,Not a problem at all,Not a problem at all,Not a problem at all,A fairly big problem,Not a problem at all,Not a problem at all,Not a very big problem,Not a problem at all,Very Safe,Very Safe,Not At All,Not At All,Not At All,A Great Deal,A Great Deal,Not Very Much,Not Very Much,"I have done this, but not primarily for the benefit of the environment","I have done this, but not primarily for the benefit of the environment","I have done this, but not primarily for the benefit of the environment","I have not done this, but I would be willing to start for the benefit of the environment","I have not done this, but I would be willing to start for the benefit of the environment","I have done this, but not primarily for the benefit of the environment","I have done this, but not primarily for the benefit of the environment","I have done this, but not primarily for the benefit of the environment",No,,Tend to Agree,None at all,Rents (With Or Without Housing Benefit),Fairly Unlikely,,,,,,,,,,,,,,,,,,,,,,,,I am just about managing financially,,,,,,,,,I am not concerned about any of these issues,,,,3,,0,,No,No,9,8,7,1,Hardly ever or never,Hardly ever or never,Hardly ever or never,NHS GP in the Westminster City Council Area,UK,,,,,Always Lived Here,Bryanston and Dorset Square,Metropolitan professionals,Cultural concerns,16,E00023487,E01004661,0.967598384
217,Male,25,,,25 - 34,Working - Full Time (30+ HRS),,White - British,,1: Not at all concerned,1: Not at all concerned,1: Not at all concerned,1: Not at all concerned,1: Not at all concerned,1: Not at all concerned,1: Not at all concerned,1: Not at all concerned,1: Not at all concerned,1: Not at all concerned,Not applicable ,1: Not at all concerned,Very Satisfied,Very Satisfied,Very Satisfied,Very Satisfied,Very Satisfied,Very Satisfied,,,,,,,None of these,,STRONGLY AGREE,(DON’T KNOW/NO OPINION),STRONGLY AGREE,STRONGLY AGREE,STRONGLY AGREE,STRONGLY AGREE,STRONGLY AGREE,STRONGLY AGREE,Internet via computer / laptop,Internet via an iPhone,,,,,,,,,,Keeps Us Very Well Informed,Keeps Us Very Well Informed,Keeps Us Very Well Informed,Keeps Us Very Well Informed,Keeps Us Very Well Informed,Westminster Reporter (the council’s magazine) - (PICTURE A),,,,,,,,,,,,Not very useful,,,,,,,,,,,,,Email,,,,,,,,,,Not a very big problem,Not a problem at all,Not a problem at all,Not a problem at all,Not a problem at all,Not a problem at all,Not a problem at all,Not a problem at all,Not a problem at all,Not a problem at all,Not a problem at all,Not a problem at all,Not a problem at all,Not a problem at all,A very big problem,Not a problem at all,Not a problem at all,Not a problem at all,Not a problem at all,Very Safe,Very Safe,A Great Deal,Not At All,Not At All,A Great Deal,A Great Deal,Not At All,Not Very Much,"I have done this, but not primarily for the benefit of the environment","I have done this, but not primarily for the benefit of the environment","I have done this, but not primarily for the benefit of the environment","I have done this, but not primarily for the benefit of the environment","I have done this, but not primarily for the benefit of the environment","I have done this, but not primarily for the benefit of the environment","I have done this, but not primarily for the benefit of the environment","I have done this, but not primarily for the benefit of the environment",No,,Tend to Agree,Not very much,Rents (With Or Without Housing Benefit),Very Unlikely,,,,,,,,,,,,,,,,,,,,,,,,I am relatively comfortable financially,,,,,,,,,I am not concerned about any of these issues,,,,3,,0,,No,No,9,9,9,1,Hardly ever or never,Hardly ever or never,Hardly ever or never,NHS GP in the Westminster City Council Area,UK,,,,,Always Lived Here,Bayswater,Metropolitan professionals,Cultural concerns,16,E00023468,E01004653,1.016170699
218,Female,51,,,50 - 54,Retired,,Asian or Asian British - Pakistani,,2,2,Not applicable ,2,1: Not at all concerned,2,2,2,1: Not at all concerned,2,Not applicable ,2,Fairly Satisfied,Very Satisfied,Very Satisfied,Very Satisfied,Very Satisfied,Very Satisfied,,,,,,,None of these,,TEND TO AGREE,STRONGLY AGREE,TEND TO AGREE,TEND TO AGREE,TEND TO AGREE,TEND TO AGREE,TEND TO AGREE,NEITHER AGREE NOR DISAGREE,Internet via computer / laptop,Internet via an iPhone,Internet via an iPad,Internet via other tablet,,,,,,,,Keeps Us Fairly Well Informed,Keeps Us Fairly Well Informed,Keeps Us Fairly Well Informed,Keeps Us Fairly Well Informed,Keeps Us Fairly Well Informed,Westminster Reporter (the council’s magazine) - (PICTURE A),Westminster Plus (magazine for older people) - (PICTURE B),Your council tax – providing an A-Z of the local services most important to you (delivered with your council tax bill in March 2020) - (PICTURE C),,,,,,,,,,Fairly Useful,Fairly Useful,Fairly Useful,,,,,,,,By publication,By Post or Letter,,,,,,,,,,,,Not a problem at all,Not a problem at all,Not a problem at all,Not a problem at all,Not a problem at all,Not a problem at all,Not a very big problem,A fairly big problem,Not a very big problem,Not a problem at all,Not a problem at all,Not a problem at all,Not a problem at all,Not a very big problem,Not a problem at all,Not a problem at all,Not a problem at all,Not a problem at all,Not a problem at all,Very Safe,Very Safe,A Great Deal,Not At All,Not At All,A Great Deal,A Fair Amount,Not At All,Not Very Much,"I have not done this, but I would be willing to start for the benefit of the environment","I have not done this, but I would be willing to start for the benefit of the environment","I have not done this, but I would be willing to start for the benefit of the environment","I have not done this, but I would be willing to start for the benefit of the environment","I have not done this, but I would be willing to start for the benefit of the environment","I have done this, but not primarily for the benefit of the environment","I have done this, but not primarily for the benefit of the environment","I have done this, but not primarily for the benefit of the environment",No,,Tend to Agree,A fair amount,Owns Outright,Very Unlikely,,,,,,,,,,,,,,,,,,,,,,,,I am relatively comfortable financially,,,,,,,,,I am not concerned about any of these issues,,,,5,,0,,No,No,9,9,7,1,Hardly ever or never,Hardly ever or never,Hardly ever or never,NHS GP in the Westminster City Council Area,UK,,,,,More than 20 Years,Bayswater,Metropolitan professionals,Cultural concerns,16,E00023468,E01004653,0.909275959
219,Female,32,,,25 - 34,Unemployed due to ill health,,White - Western European (type in),Spainish,5: Very concerned,5: Very concerned,1: Not at all concerned,2,1: Not at all concerned,Not applicable ,5: Very concerned,3,1: Not at all concerned,1: Not at all concerned,Not applicable ,2,Fairly Satisfied,Very Satisfied,Very Satisfied,Very Satisfied,Very Satisfied,Fairly Satisfied,,,,,,,None of these,,NEITHER AGREE NOR DISAGREE,TEND TO AGREE,TEND TO AGREE,TEND TO AGREE,TEND TO AGREE,TEND TO AGREE,STRONGLY AGREE,TEND TO AGREE,,Internet via an iPhone,,,,,,,,,,Gives us only a Limited Amount of Information,Gives us only a Limited Amount of Information,Keeps Us Fairly Well Informed,Keeps Us Fairly Well Informed,Gives us only a Limited Amount of Information,,,,,,,,,YourHome Magazine (the council’s magazine for Westminster housing residents) - (PICTURE I),,,,,,,,,,,,(Don't know / No opinion),,,By Post or Letter,,,,,,,,,,,,Not a problem at all,A fairly big problem,Not a problem at all,Not a problem at all,Not a very big problem,Not a problem at all,Not a very big problem,A fairly big problem,A fairly big problem,A fairly big problem,Not a very big problem,Not a problem at all,Not a problem at all,Not a problem at all,Not a problem at all,Not a problem at all,Not a problem at all,Not a problem at all,Not a problem at all,Fairly Safe,Fairly Safe,Not At All,Not At All,Not At All,A Great Deal,A Great Deal,Not At All,Not Very Much,"I have done this, but not primarily for the benefit of the environment","I have not done this, but I would be willing to start for the benefit of the environment",(Not applicable),(Not applicable),"I have done this, but not primarily for the benefit of the environment","I have done this, primarily for the benefit of the environment","I have done this, but not primarily for the benefit of the environment","I have done this, primarily for the benefit of the environment",No,,Definitely Agree,Not very much,Rents (With Or Without Housing Benefit),Very Unlikely,,,,,,,,,,,,,,,,,,,,,,,,"I am not really managing financially, and often struggle to make ends meet","Paying fuel bills (eg gas, electricity)",,,,,,,,,,,,2,,0,,Yes,"Yes, Limited a little",7,4,4,4,Some of the time,Some of the time,Some of the time,NHS GP in the Westminster City Council Area,,"Other EU, EEA or Swiss national",,,,More than 20 Years,Church Street,"Multi-ethnic, purpose-built estates",Despondent diversity,54,E00023571,E01033602,1.19627932
220,Female,54,,,50 - 54,Working - Full Time (30+ HRS),,Black or Black British - African,,5: Very concerned,4,4,4,4,4,4,4,4,4,4,4,Fairly Satisfied,Very Satisfied,Very Satisfied,Very Satisfied,Very Satisfied,Very Satisfied,,,,,,,None of these,,TEND TO AGREE,TEND TO AGREE,NEITHER AGREE NOR DISAGREE,TEND TO AGREE,NEITHER AGREE NOR DISAGREE,TEND TO AGREE,TEND TO AGREE,STRONGLY AGREE,Internet via computer / laptop,,,,Internet via an Android smartphone,,Internet via a games console connected to TV,,,,,Keeps Us Fairly Well Informed,Keeps Us Very Well Informed,Keeps Us Fairly Well Informed,Keeps Us Fairly Well Informed,Keeps Us Fairly Well Informed,,Westminster Plus (magazine for older people) - (PICTURE B),,Council website (www.westminster.gov.uk) - (PICTURE D),,,"Westminster City Save website, brochure or card (the council’s discount scheme www. westminster.gov.uk/citysave - (PICTURE G)",,,,,,,Very Useful,,Very Useful,,,Very Useful,,,,,,,,,,,,,,None of these - I'm not interested,,,Not a problem at all,Not a very big problem,Not a problem at all,Not a problem at all,Not a very big problem,Not a problem at all,Not a very big problem,Not a very big problem,A fairly big problem,Not a problem at all,Not a problem at all,Not a problem at all,Not a problem at all,A fairly big problem,Not a problem at all,Not a problem at all,Not a problem at all,Not a problem at all,Not a problem at all,Fairly Safe,Fairly Safe,Not At All,Not At All,Not At All,A Great Deal,A Great Deal,A Fair Amount,A Fair Amount,"I have not done this, but I would be willing to start for the benefit of the environment","I have not done this, but I would be willing to start for the benefit of the environment","I have not done this, but I would be willing to start for the benefit of the environment","I have not done this, but I would be willing to start for the benefit of the environment","I have done this, but not primarily for the benefit of the environment","I have done this, but not primarily for the benefit of the environment","I have done this, but not primarily for the benefit of the environment","I have done this, but not primarily for the benefit of the environment",No,,Tend to Agree,A fair amount,Rents (With Or Without Housing Benefit),Very Unlikely,,,,,,,,,,,,,,,,,,,,,,,,I am just about managing financially,,,,,,,,,I am not concerned about any of these issues,,,,3,,0,,No,No,9,8,7,7,Some of the time,Some of the time,Some of the time,NHS GP in the Westminster City Council Area,UK,,,,,More than 20 Years,Church Street,Deprived and ethnically diverse in flats,Despondent diversity,55,E00023564,E01004670,0.77238882
